Item Code,Item Description,Barcode,Category,Price,Image Filename
111520,PREMIUM BELGIUM WRAPPED WHITE PISTACHIO LEAF PISTACHIO & CRISPY & CARAMEL KG,1351214111520,BELGIUM - WRAPPED,135.00,111126.png
111521,PREMIUM BELGIUM WRAPPED WHITE PISTACHIO LUXE PISTACHIO KG,1351214111521,BELGIUM - WRAPPED,135.00,111124.jpg
111522,PREMIUM BELGIUM WRAPPED WHITE PLAIN SQUARE PLAIN SQUARE KG,1351214111522,BELGIUM - WRAPPED,135.00,111522.png
111523,PREMIUM BELGIUM WRAPPED WHITE REGAL SQUARE PISTACHIO & MASTIC KG,1351214111523,BELGIUM - WRAPPED,135.00,111086.jpg
111524,PREMIUM BELGIUM WRAPPED WHITE ROYAL BAR FEUILLETINE BISCUIT & CHOCOLATE KG,1351214111524,BELGIUM - WRAPPED,135.00,111101.jpg
111525,PREMIUM BELGIUM WRAPPED WHITE ROYAL CARAMEL BAR  CARAMEL & CHOCOLATE KG,1351214111525,BELGIUM - WRAPPED,135.00,111102.jpg
111526,PREMIUM BELGIUM WRAPPED WHITE ROYAL SEAL NOUGAT & ALMONDS KG,1351214111526,BELGIUM - WRAPPED,135.00,111087.jpg
111527,PREMIUM BELGIUM WRAPPED WHITE RUBY PRISM GIANDUJA & CARAMEL KG,1351214111527,BELGIUM - WRAPPED,135.00,111125.jpg
111528,PREMIUM BELGIUM WRAPPED WHITE SNOW HOUSE CHOCOLATE & NUTS & PISTACHIO KG,1351214111528,BELGIUM - WRAPPED,135.00,111120.jpg
111529,PREMIUM BELGIUM WRAPPED WHITE TRIO HARMONY A HAZELNUT & CARAMEL KG,1351214111529,BELGIUM - WRAPPED,135.00,111091.png
111530,PREMIUM BELGIUM WRAPPED WHITE TEAR HAZELNUT KG,1351214111530,BELGIUM - WRAPPED,135.00,111127.png
111537,PREMIUM BELGIUM WRAPPED RED ANDALUSIA GIANDUJA & CARAMEL & CRISPY KG,1351214111537,BELGIUM - WRAPPED,135.00,111112.png
111538,PREMIUM BELGIUM WRAPPED RED BLISS SQUARE GIANDUJA & CARAMEL & HAZELNUTS KG,1351214111538,BELGIUM - WRAPPED,135.00,111088.jpg
111539,PREMIUM BELGIUM WRAPPED RED CHOCO ALMOND SQUARE ALMOND KG,1351214111539,BELGIUM - WRAPPED,135.00,111539.png
111540,PREMIUM BELGIUM WRAPPED RED CHOCO BALL HAZELNUT PASTE KG,1351214111540,BELGIUM - WRAPPED,135.00,111099.jpg
111541,PREMIUM BELGIUM WRAPPED RED CHOCO BRICK PRALINE SESAME & CARAMEL KG,1351214111541,BELGIUM - WRAPPED,135.00,111114.png
111542,PREMIUM BELGIUM WRAPPED RED CHOCO CRISPY SQUARE CRISPY KG,1351214111542,BELGIUM - WRAPPED,135.00,111140.jpg
111543,PREMIUM BELGIUM WRAPPED RED CHOCO DOME CHEESECAKE & STRAWBERRIES KG,1351214111543,BELGIUM - WRAPPED,135.00,111110.jpg
111544,PREMIUM BELGIUM WRAPPED RED CHOCO HAZELNUT SQUARE  HAZELNUT KG,1351214111544,BELGIUM - WRAPPED,135.00,111544.png
111545,PREMIUM BELGIUM WRAPPED RED PISTACHIO KUNAFA KG,1351214111545,BELGIUM - WRAPPED,180.00,110944.jpg
111546,PREMIUM BELGIUM WRAPPED RED CHOCO MAP SAFFRON & PISTACHIO KG,1351214111546,BELGIUM - WRAPPED,135.00,111090.png
111547,PREMIUM BELGIUM WRAPPED RED CHOCO MATRESS GIANDUJA & NUTS & FEUILLETINE KG,1351214111547,BELGIUM - WRAPPED,135.00,111096.jpg
111548,PREMIUM BELGIUM WRAPPED RED CHOCO PISTACHIO SQUARE PISTACHIO KG,1351214111548,BELGIUM - WRAPPED,135.00,111138.jpg
111549,PREMIUM BELGIUM WRAPPED RED CHOCO PLAIN SQUARE PLAIN KG,1351214111549,BELGIUM - WRAPPED,135.00,111136.jpg
111550,PREMIUM BELGIUM WRAPPED RED CHOCO RING OREO BISCUIT FILLING KG,1351214111550,BELGIUM - WRAPPED,135.00,111116.jpg
111551,PREMIUM BELGIUM WRAPPED RED CHOCO RIPPLE CUP CARAMEL & CREAM KG,1351214111551,BELGIUM - WRAPPED,135.00,111093.png
111552,PREMIUM BELGIUM WRAPPED RED CHOCO SQUIRREL CHEESECAKE & STRAWBERRIES  & BISCUIT KG,1351214111552,BELGIUM - WRAPPED,135.00,111094.png
111553,PREMIUM BELGIUM WRAPPED RED CHOCO SQUIRREL COFFEE FILLING & CREAM KG,1351214111553,BELGIUM - WRAPPED,135.00,111117.png
111554,PREMIUM BELGIUM WRAPPED RED CHOCO SQUIRREL HAZELNUT NOUGAT & ALMONDS & CARAMEL KG,1351214111554,BELGIUM - WRAPPED,135.00,111097.jpg
111555,PREMIUM BELGIUM WRAPPED RED CHOCO SQUIRREL PLAIN & BELGIAN KG,1351214111555,BELGIUM - WRAPPED,135.00,111130.jpg
111556,PREMIUM BELGIUM WRAPPED RED CHOCO SWIRL TRUFFLE & PISTACHIO NUTS KG,1351214111556,BELGIUM - WRAPPED,135.00,111119.jpg
111557,PREMIUM BELGIUM WRAPPED RED CHOCO TEAR GIANDUJA & CARAMEL & FEUILLETINE  & NUTS & HAZELNUTS KG,1351214111557,BELGIUM - WRAPPED,135.00,111092.jpg
111558,PREMIUM BELGIUM WRAPPED RED CHOCO WAFER SQUARE WAFER KG,1351214111558,BELGIUM - WRAPPED,135.00,111137.jpg
111560,PREMIUM BELGIUM WRAPPED RED CORNFLAKES KG,1351214111560,BELGIUM - WRAPPED,135.00,111473.jpg
111561,PREMIUM BELGIUM WRAPPED RED DALLAH COFFEE KG,1351214111561,BELGIUM - WRAPPED,135.00,111104.jpg
111562,PREMIUM BELGIUM WRAPPED RED DIRHAM NUTELLA & HAZELNUTS KG,1351214111562,BELGIUM - WRAPPED,135.00,111095.jpg
111563,PREMIUM BELGIUM WRAPPED RED GOLDEN LINE HAZELNUT GIANDUJA & CARAMEL KG,1351214111563,BELGIUM - WRAPPED,135.00,111098.png
111564,PREMIUM BELGIUM WRAPPED RED GOLDEN LINE PEANUT & CARAMEL KG,1351214111564,BELGIUM - WRAPPED,135.00,111115.png
111565,PREMIUM BELGIUM WRAPPED RED HAZEL CROWN NUTELLA & HAZELNUTS KG,1351214111565,BELGIUM - WRAPPED,135.00,111103.jpg
111566,PREMIUM BELGIUM WRAPPED RED HAZELNUT CARAMEL KG,1351214111566,BELGIUM - WRAPPED,135.00,111311.jpg
111567,PREMIUM BELGIUM WRAPPED RED HAZELNUT PES HAZELNUT PRALINE & TRUFFLE & WHOLE HAZELNUT KG,1351214111567,BELGIUM - WRAPPED,135.00,111111.png
111568,PREMIUM BELGIUM WRAPPED RED TEAR HAZELNUT KG,1351214111568,BELGIUM - WRAPPED,135.00,111127.png
111569,PREMIUM BELGIUM WRAPPED RED HEART HAZELNUT GIANDUJA & ALMOND NUTS KG,1351214111569,BELGIUM - WRAPPED,135.00,111118.jpg
111570,PREMIUM BELGIUM WRAPPED RED HEART PRALINE HAZELNUT CARAMEL KG,1351214111570,BELGIUM - WRAPPED,135.00,111281.jpg
111571,PREMIUM BELGIUM WRAPPED RED LULU CUP CUP OF KIBANDER & LULU PIECE KG,1351214111571,BELGIUM - WRAPPED,135.00,111122.jpg
111577,PREMIUM BELGIUM WRAPPED RED MUSHROOM NOUGAT & MIXED NUTS &  HAZELNUTS & GIANDUJA KG,1351214111577,BELGIUM - WRAPPED,135.00,111100.png
111578,"PREMIUM BELGIUM WRAPPED RED PARIS HAZELNUT PRALINE & HONEY, CARAMEL & HAZELNUTS & COFFEE KG",1351214111578,BELGIUM - WRAPPED,135.00,111089.jpg
111579,PREMIUM BELGIUM WRAPPED RED PARIS PLAIN KG,1351214111579,BELGIUM - WRAPPED,135.00,111135.png
111580,PREMIUM BELGIUM WRAPPED RED PISTACHIO LEAF PISTACHIO & CRISPY & CARAMEL KG,1351214111580,BELGIUM - WRAPPED,135.00,111126.png
111581,PREMIUM BELGIUM WRAPPED RED PISTACHIO LUXE PISTACHIO KG,1351214111581,BELGIUM - WRAPPED,135.00,111124.jpg
111582,PREMIUM BELGIUM WRAPPED RED PISTACHIO ROSE PISTACHIO ROSE KG,1351214111582,BELGIUM - WRAPPED,135.00,111128.jpg
111583,PREMIUM BELGIUM WRAPPED RED PLAIN SQUARE PLAIN SQUARE KG,1351214111583,BELGIUM - WRAPPED,135.00,111583.png
111584,PREMIUM BELGIUM WRAPPED RED REGAL SQUARE PISTACHIO & MASTIC KG,1351214111584,BELGIUM - WRAPPED,135.00,111086.jpg
111585,PREMIUM BELGIUM WRAPPED RED ROYAL BAR FEUILLETINE BISCUIT & CHOCOLATE KG,1351214111585,BELGIUM - WRAPPED,135.00,111101.jpg
111586,PREMIUM BELGIUM WRAPPED RED ROYAL CARAMEL BAR  CARAMEL & CHOCOLATE KG,1351214111586,BELGIUM - WRAPPED,135.00,111102.jpg
111587,PREMIUM BELGIUM WRAPPED RED ROYAL SEAL NOUGAT & ALMONDS KG,1351214111587,BELGIUM - WRAPPED,135.00,111087.jpg
111588,PREMIUM BELGIUM WRAPPED RED RUBY PRISM GIANDUJA & CARAMEL KG,1351214111588,BELGIUM - WRAPPED,135.00,111125.jpg
111589,PREMIUM BELGIUM WRAPPED RED SNOW HOUSE CHOCOLATE & NUTS & PISTACHIO KG,1351214111589,BELGIUM - WRAPPED,135.00,111120.jpg
111590,PREMIUM BELGIUM WRAPPED RED SQUARE WITH LOTUS KG,1351214111590,BELGIUM - WRAPPED,135.00,111590.png
111591,PREMIUM BELGIUM WRAPPED RED TRIO HARMONY A HAZELNUT & CARAMEL KG,1351214111591,BELGIUM - WRAPPED,135.00,111091.png
111598,PREMIUM BELGIUM WRAPPED PINK ANDALUSIA GIANDUJA & CARAMEL & CRISPY KG,1351214111598,BELGIUM - WRAPPED,135.00,111112.png
111599,PREMIUM BELGIUM WRAPPED PINK BLISS SQUARE GIANDUJA & CARAMEL & HAZELNUTS KG,1351214111599,BELGIUM - WRAPPED,135.00,111088.jpg
111600,PREMIUM BELGIUM WRAPPED PINK CHOCO ALMOND SQUARE ALMOND KG,1351214111600,BELGIUM - WRAPPED,135.00,111600.png
111601,PREMIUM BELGIUM WRAPPED PINK CHOCO BALL HAZELNUT PASTE KG,1351214111601,BELGIUM - WRAPPED,135.00,111099.jpg
111602,PREMIUM BELGIUM WRAPPED PINK CHOCO BRICK PRALINE SESAME & CARAMEL KG,1351214111602,BELGIUM - WRAPPED,135.00,111114.png
111603,PREMIUM BELGIUM WRAPPED PINK CHOCO CRISPY SQUARE CRISPY KG,1351214111603,BELGIUM - WRAPPED,135.00,111140.jpg
111604,PREMIUM BELGIUM WRAPPED PINK CHOCO DOME CHEESECAKE & STRAWBERRIES KG,1351214111604,BELGIUM - WRAPPED,135.00,111110.jpg
111605,PREMIUM BELGIUM WRAPPED PINK CHOCO HAZELNUT SQUARE  HAZELNUT KG,1351214111605,BELGIUM - WRAPPED,135.00,111605.png
111606,PREMIUM BELGIUM WRAPPED PINK PISTACHIO KUNAFA KG,1351214111606,BELGIUM - WRAPPED,180.00,110944.jpg
111607,PREMIUM BELGIUM WRAPPED PINK CHOCO MAP SAFFRON & PISTACHIO KG,1351214111607,BELGIUM - WRAPPED,135.00,111090.png
111608,PREMIUM BELGIUM WRAPPED PINK CHOCO MATRESS GIANDUJA & NUTS & FEUILLETINE KG,1351214111608,BELGIUM - WRAPPED,135.00,111096.jpg
111609,PREMIUM BELGIUM WRAPPED PINK CHOCO PISTACHIO SQUARE PISTACHIO KG,1351214111609,BELGIUM - WRAPPED,135.00,111138.jpg
111610,PREMIUM BELGIUM WRAPPED PINK CHOCO PLAIN SQUARE PLAIN KG,1351214111610,BELGIUM - WRAPPED,135.00,111136.jpg
111611,PREMIUM BELGIUM WRAPPED PINK CHOCO RING OREO BISCUIT FILLING KG,1351214111611,BELGIUM - WRAPPED,135.00,111116.jpg
111612,PREMIUM BELGIUM WRAPPED PINK CHOCO RIPPLE CUP CARAMEL & CREAM KG,1351214111612,BELGIUM - WRAPPED,135.00,111093.png
111613,PREMIUM BELGIUM WRAPPED PINK CHOCO SQUIRREL CHEESECAKE & STRAWBERRIES  & BISCUIT KG,1351214111613,BELGIUM - WRAPPED,135.00,111094.png
111614,PREMIUM BELGIUM WRAPPED PINK CHOCO SQUIRREL COFFEE FILLING & CREAM KG,1351214111614,BELGIUM - WRAPPED,135.00,111117.png
111615,PREMIUM BELGIUM WRAPPED PINK CHOCO SQUIRREL HAZELNUT NOUGAT & ALMONDS & CARAMEL KG,1351214111615,BELGIUM - WRAPPED,135.00,111097.jpg
111616,PREMIUM BELGIUM WRAPPED PINK CHOCO SQUIRREL PLAIN & BELGIAN KG,1351214111616,BELGIUM - WRAPPED,135.00,111130.jpg
111617,PREMIUM BELGIUM WRAPPED PINK CHOCO SWIRL TRUFFLE & PISTACHIO NUTS KG,1351214111617,BELGIUM - WRAPPED,135.00,111119.jpg
111618,PREMIUM BELGIUM WRAPPED PINK CHOCO TEAR GIANDUJA & CARAMEL & FEUILLETINE  & NUTS & HAZELNUTS KG,1351214111618,BELGIUM - WRAPPED,135.00,111092.jpg
111619,PREMIUM BELGIUM WRAPPED PINK CHOCO WAFER SQUARE WAFER KG,1351214111619,BELGIUM - WRAPPED,135.00,111137.jpg
111621,PREMIUM BELGIUM WRAPPED PINK CORNFLAKES KG,1351214111621,BELGIUM - WRAPPED,135.00,111473.jpg
111622,PREMIUM BELGIUM WRAPPED PINK DALLAH COFFEE KG,1351214111622,BELGIUM - WRAPPED,135.00,111104.jpg
111623,PREMIUM BELGIUM WRAPPED PINK DIRHAM NUTELLA & HAZELNUTS KG,1351214111623,BELGIUM - WRAPPED,135.00,111095.jpg
111624,PREMIUM BELGIUM WRAPPED PINK GOLDEN LINE HAZELNUT GIANDUJA & CARAMEL KG,1351214111624,BELGIUM - WRAPPED,135.00,111098.png
111625,PREMIUM BELGIUM WRAPPED PINK GOLDEN LINE PEANUT & CARAMEL KG,1351214111625,BELGIUM - WRAPPED,135.00,111115.png
111626,PREMIUM BELGIUM WRAPPED PINK HAZEL CROWN NUTELLA & HAZELNUTS KG,1351214111626,BELGIUM - WRAPPED,135.00,111103.jpg
111627,PREMIUM BELGIUM WRAPPED PINK HAZELNUT CARAMEL KG,1351214111627,BELGIUM - WRAPPED,135.00,111311.jpg
111628,PREMIUM BELGIUM WRAPPED PINK HAZELNUT PES HAZELNUT PRALINE & TRUFFLE & WHOLE HAZELNUT KG,1351214111628,BELGIUM - WRAPPED,135.00,111111.png
111629,PREMIUM BELGIUM WRAPPED PINK HEART HAZELNUT GIANDUJA & ALMOND NUTS KG,1351214111629,BELGIUM - WRAPPED,135.00,111118.jpg
111630,PREMIUM BELGIUM WRAPPED PINK HEART PRALINE HAZELNUT CARAMEL KG,1351214111630,BELGIUM - WRAPPED,135.00,111281.jpg
111631,PREMIUM BELGIUM WRAPPED PINK LULU CUP CUP OF KIBANDER & LULU PIECE KG,1351214111631,BELGIUM - WRAPPED,135.00,111122.jpg
111637,PREMIUM BELGIUM WRAPPED PINK MUSHROOM NOUGAT & MIXED NUTS &  HAZELNUTS & GIANDUJA KG,1351214111637,BELGIUM - WRAPPED,135.00,111100.png
111638,"PREMIUM BELGIUM WRAPPED PINK PARIS HAZELNUT PRALINE & HONEY, CARAMEL & HAZELNUTS & COFFEE KG",1351214111638,BELGIUM - WRAPPED,135.00,111089.jpg
111639,PREMIUM BELGIUM WRAPPED PINK PARIS PLAIN KG,1351214111639,BELGIUM - WRAPPED,135.00,111135.png
111640,PREMIUM BELGIUM WRAPPED PINK PISTACHIO LEAF PISTACHIO & CRISPY & CARAMEL KG,1351214111640,BELGIUM - WRAPPED,135.00,111126.png
111641,PREMIUM BELGIUM WRAPPED PINK PISTACHIO LUXE PISTACHIO KG,1351214111641,BELGIUM - WRAPPED,135.00,111124.jpg
111642,PREMIUM BELGIUM WRAPPED PINK PISTACHIO ROSE PISTACHIO ROSE KG,1351214111642,BELGIUM - WRAPPED,135.00,111128.jpg
111643,PREMIUM BELGIUM WRAPPED PINK PLAIN SQUARE PLAIN SQUARE KG,1351214111643,BELGIUM - WRAPPED,135.00,111643.png
111644,PREMIUM BELGIUM WRAPPED PINK REGAL SQUARE PISTACHIO & MASTIC KG,1351214111644,BELGIUM - WRAPPED,135.00,111086.jpg
111645,PREMIUM BELGIUM WRAPPED PINK ROYAL BAR FEUILLETINE BISCUIT & CHOCOLATE KG,1351214111645,BELGIUM - WRAPPED,135.00,111101.jpg
111646,PREMIUM BELGIUM WRAPPED PINK ROYAL CARAMEL BAR  CARAMEL & CHOCOLATE KG,1351214111646,BELGIUM - WRAPPED,135.00,111102.jpg
111647,PREMIUM BELGIUM WRAPPED PINK ROYAL SEAL NOUGAT & ALMONDS KG,1351214111647,BELGIUM - WRAPPED,135.00,111087.jpg
111648,PREMIUM BELGIUM WRAPPED PINK RUBY PRISM GIANDUJA & CARAMEL KG,1351214111648,BELGIUM - WRAPPED,135.00,111125.jpg
111649,PREMIUM BELGIUM WRAPPED PINK SNOW HOUSE CHOCOLATE & NUTS & PISTACHIO KG,1351214111649,BELGIUM - WRAPPED,135.00,111120.jpg
111650,PREMIUM BELGIUM WRAPPED PINK SQUARE WITH LOTUS KG,1351214111650,BELGIUM - WRAPPED,135.00,111650.png
111651,PREMIUM BELGIUM WRAPPED PINK TRIO HARMONY A HAZELNUT & CARAMEL KG,1351214111651,BELGIUM - WRAPPED,135.00,111091.png
111658,PREMIUM BELGIUM WRAPPED GREEN ANDALUSIA GIANDUJA & CARAMEL & CRISPY KG,1351214111658,BELGIUM - WRAPPED,135.00,111112.png
111659,PREMIUM BELGIUM WRAPPED GREEN BLISS SQUARE GIANDUJA & CARAMEL & HAZELNUTS KG,1351214111659,BELGIUM - WRAPPED,135.00,111088.jpg
111660,PREMIUM BELGIUM WRAPPED GREEN CHOCO ALMOND SQUARE ALMOND KG,1351214111660,BELGIUM - WRAPPED,135.00,111660.png
111661,PREMIUM BELGIUM WRAPPED GREEN CHOCO BALL HAZELNUT PASTE KG,1351214111661,BELGIUM - WRAPPED,135.00,111099.jpg
111662,PREMIUM BELGIUM WRAPPED GREEN CHOCO BRICK PRALINE SESAME & CARAMEL KG,1351214111662,BELGIUM - WRAPPED,135.00,111114.png
111663,PREMIUM BELGIUM WRAPPED GREEN CHOCO CRISPY SQUARE CRISPY KG,1351214111663,BELGIUM - WRAPPED,135.00,111140.jpg
111664,PREMIUM BELGIUM WRAPPED GREEN CHOCO DOME CHEESECAKE & STRAWBERRIES KG,1351214111664,BELGIUM - WRAPPED,135.00,111110.jpg
111665,PREMIUM BELGIUM WRAPPED GREEN CHOCO HAZELNUT SQUARE  HAZELNUT KG,1351214111665,BELGIUM - WRAPPED,135.00,111665.png
111666,PREMIUM BELGIUM WRAPPED GREEN PISTACHIO KUNAFA KG,1351214111666,BELGIUM - WRAPPED,180.00,110944.jpg
111667,PREMIUM BELGIUM WRAPPED GREEN CHOCO MAP SAFFRON & PISTACHIO KG,1351214111667,BELGIUM - WRAPPED,135.00,111090.png
111668,PREMIUM BELGIUM WRAPPED GREEN CHOCO MATRESS GIANDUJA & NUTS & FEUILLETINE KG,1351214111668,BELGIUM - WRAPPED,135.00,111096.jpg
111669,PREMIUM BELGIUM WRAPPED GREEN CHOCO PISTACHIO SQUARE PISTACHIO KG,1351214111669,BELGIUM - WRAPPED,135.00,111138.jpg
111670,PREMIUM BELGIUM WRAPPED GREEN CHOCO PLAIN SQUARE PLAIN KG,1351214111670,BELGIUM - WRAPPED,135.00,111136.jpg
111672,PREMIUM BELGIUM WRAPPED GREEN CHOCO RIPPLE CUP CARAMEL & CREAM KG,1351214111672,BELGIUM - WRAPPED,135.00,111093.png
111673,PREMIUM BELGIUM WRAPPED GREEN CHOCO SQUIRREL CHEESECAKE & STRAWBERRIES  & BISCUIT KG,1351214111673,BELGIUM - WRAPPED,135.00,111094.png
111674,PREMIUM BELGIUM WRAPPED GREEN CHOCO SQUIRREL COFFEE FILLING & CREAM KG,1351214111674,BELGIUM - WRAPPED,135.00,111117.png
111675,PREMIUM BELGIUM WRAPPED GREEN CHOCO SQUIRREL HAZELNUT NOUGAT & ALMONDS & CARAMEL KG,1351214111675,BELGIUM - WRAPPED,135.00,111097.jpg
111676,PREMIUM BELGIUM WRAPPED GREEN CHOCO SQUIRREL PLAIN & BELGIAN KG,1351214111676,BELGIUM - WRAPPED,135.00,111130.jpg
111677,PREMIUM BELGIUM WRAPPED GREEN CHOCO SWIRL TRUFFLE & PISTACHIO NUTS KG,1351214111677,BELGIUM - WRAPPED,135.00,111119.jpg
111678,PREMIUM BELGIUM WRAPPED GREEN CHOCO TEAR GIANDUJA & CARAMEL & FEUILLETINE  & NUTS & HAZELNUTS KG,1351214111678,BELGIUM - WRAPPED,135.00,111092.jpg
111679,PREMIUM BELGIUM WRAPPED GREEN CHOCO WAFER SQUARE WAFER KG,1351214111679,BELGIUM - WRAPPED,135.00,111137.jpg
111681,PREMIUM BELGIUM WRAPPED GREEN CORNFLAKES KG,1351214111681,BELGIUM - WRAPPED,135.00,111473.jpg
111682,PREMIUM BELGIUM WRAPPED GREEN DALLAH COFFEE KG,1351214111682,BELGIUM - WRAPPED,135.00,111104.jpg
111683,PREMIUM BELGIUM WRAPPED GREEN DIRHAM NUTELLA & HAZELNUTS KG,1351214111683,BELGIUM - WRAPPED,135.00,111095.jpg
111684,PREMIUM BELGIUM WRAPPED GREEN GOLDEN LINE HAZELNUT GIANDUJA & CARAMEL KG,1351214111684,BELGIUM - WRAPPED,135.00,111098.png
111685,PREMIUM BELGIUM WRAPPED GREEN GOLDEN LINE PEANUT & CARAMEL KG,1351214111685,BELGIUM - WRAPPED,135.00,111115.png
111686,PREMIUM BELGIUM WRAPPED GREEN HAZEL CROWN NUTELLA & HAZELNUTS KG,1351214111686,BELGIUM - WRAPPED,135.00,111103.jpg
111687,PREMIUM BELGIUM WRAPPED GREEN HAZELNUT CARAMEL KG,1351214111687,BELGIUM - WRAPPED,135.00,111311.jpg
111688,PREMIUM BELGIUM WRAPPED GREEN HAZELNUT PES HAZELNUT PRALINE & TRUFFLE & WHOLE HAZELNUT KG,1351214111688,BELGIUM - WRAPPED,135.00,111111.png
111689,PREMIUM BELGIUM WRAPPED GREEN TEAR HAZELNUT KG,1351214111689,BELGIUM - WRAPPED,135.00,111127.png
111690,PREMIUM BELGIUM WRAPPED GREEN HEART HAZELNUT GIANDUJA & ALMOND NUTS KG,1351214111690,BELGIUM - WRAPPED,135.00,111118.jpg
111691,PREMIUM BELGIUM WRAPPED GREEN HEART PRALINE HAZELNUT CARAMEL KG,1351214111691,BELGIUM - WRAPPED,135.00,111281.jpg
111692,PREMIUM BELGIUM WRAPPED GREEN LULU CUP CUP OF KIBANDER & LULU PIECE KG,1351214111692,BELGIUM - WRAPPED,135.00,111122.jpg
111698,PREMIUM BELGIUM WRAPPED GREEN MUSHROOM NOUGAT & MIXED NUTS &  HAZELNUTS & GIANDUJA KG,1351214111698,BELGIUM - WRAPPED,135.00,111100.png
111699,"PREMIUM BELGIUM WRAPPED GREEN PARIS HAZELNUT PRALINE & HONEY, CARAMEL & HAZELNUTS & COFFEE KG",1351214111699,BELGIUM - WRAPPED,135.00,111089.jpg
111700,PREMIUM BELGIUM WRAPPED GREEN PARIS PLAIN KG,1351214111700,BELGIUM - WRAPPED,135.00,111135.png
111701,PREMIUM BELGIUM WRAPPED GREEN PISTACHIO LEAF PISTACHIO & CRISPY & CARAMEL KG,1351214111701,BELGIUM - WRAPPED,135.00,111126.png
111702,PREMIUM BELGIUM WRAPPED GREEN PISTACHIO LUXE PISTACHIO KG,1351214111702,BELGIUM - WRAPPED,135.00,111124.jpg
111703,PREMIUM BELGIUM WRAPPED GREEN PISTACHIO ROSE PISTACHIO ROSE KG,1351214111703,BELGIUM - WRAPPED,135.00,111128.jpg
111704,PREMIUM BELGIUM WRAPPED GREEN PLAIN SQUARE PLAIN SQUARE KG,1351214111704,BELGIUM - WRAPPED,135.00,111704.png
111705,PREMIUM BELGIUM WRAPPED GREEN REGAL SQUARE PISTACHIO & MASTIC KG,1351214111705,BELGIUM - WRAPPED,135.00,111086.jpg
111706,PREMIUM BELGIUM WRAPPED GREEN ROYAL BAR FEUILLETINE BISCUIT & CHOCOLATE KG,1351214111706,BELGIUM - WRAPPED,135.00,111101.jpg
111707,PREMIUM BELGIUM WRAPPED GREEN ROYAL CARAMEL BAR  CARAMEL & CHOCOLATE KG,1351214111707,BELGIUM - WRAPPED,135.00,111102.jpg
111708,PREMIUM BELGIUM WRAPPED GREEN ROYAL SEAL NOUGAT & ALMONDS KG,1351214111708,BELGIUM - WRAPPED,135.00,111087.jpg
111709,PREMIUM BELGIUM WRAPPED GREEN RUBY PRISM GIANDUJA & CARAMEL KG,1351214111709,BELGIUM - WRAPPED,135.00,111125.jpg
111710,PREMIUM BELGIUM WRAPPED GREEN SNOW HOUSE CHOCOLATE & NUTS & PISTACHIO KG,1351214111710,BELGIUM - WRAPPED,135.00,111120.jpg
111711,PREMIUM BELGIUM WRAPPED GREEN SQUARE WITH LOTUS KG,1351214111711,BELGIUM - WRAPPED,135.00,111711.png
111712,PREMIUM BELGIUM WRAPPED GREEN TRIO HARMONY A HAZELNUT & CARAMEL KG,1351214111712,BELGIUM - WRAPPED,135.00,111091.png
111991,PREMIUM BELGIUM WRAPPED BROWN CHOCO PRALINE HAZELNUT CARAMEL KG,1351214111991,BELGIUM - WRAPPED,135.00,111991.jpg
111992,PREMIUM BELGIUM WRAPPED BROWN PISTACHIO KG,1351214111992,BELGIUM - WRAPPED,135.00,111992.jpg
111993,PREMIUM BELGIUM WRAPPED BROWN REGAL SQUARE ALMOND CREAM KG,1351214111993,BELGIUM - WRAPPED,135.00,111993.jpg
111994,PREMIUM BELGIUM WRAPPED BROWN REGAL SQUARE HAZELNUT CREAM KG,1351214111994,BELGIUM - WRAPPED,135.00,111994.jpg
112031,PREMIUM BELGIUM WRAPPED BROWN DARK CHOCOLATE 100% KG,1351214112031,BELGIUM - WRAPPED,135.00,112031.png
112032,PREMIUM BELGIUM WRAPPED BROWN DARK CHOCOLATE KG,1351214112032,BELGIUM - WRAPPED,135.00,112032.png
112033,PREMIUM BELGIUM WRAPPED BROWN DIET CHOCOLATE KG,1351214112033,BELGIUM - WRAPPED,135.00,112033.png
112041,PREMIUM BELGIUM WRAPPED BROWN BALALATA CHOCO LARGE 7.2*7.2 KG,1351214112041,BELGIUM - WRAPPED,135.00,112041.jpg
112212,PREMIUM BELGIUM WRAPPED BROWN RECT ALMOND,1351214112212,BELGIUM - WRAPPED,135.00,112212.png
112215,PREMIUM BELGIUM WRAPPED BROWN RECT EYE PRALINE HAZELNUT KG,1351214112215,BELGIUM - WRAPPED,135.00,112215.jpg
112219,PREMIUM BELGIUM WRAPPED BROWN MISTIKA KG,1351214112219,BELGIUM - WRAPPED,135.00,112219.png
112223,PREMIUM BELGIUM WRAPPED BROWN PISTACHIO RAHASH KG,1351214112223,BELGIUM - WRAPPED,135.00,112223.png
112255,PREMIUM BELGIUM WRAPPED BROWN ENG ALPHABETS GIANDUIA WITH HAZELNUT KG,1351214112255,BELGIUM - WRAPPED,135.00,112255.jpg
112259,PREMIUM BELGIUM WRAPPED BROWN CRISPY WITH WHITE CREAM KG,1351214112259,BELGIUM - WRAPPED,135.00,112259.jpg
112293,PREMIUM BELGIUM WRAPPED BROWN ZAFRAN KG,1351214112293,BELGIUM - WRAPPED,135.00,112293.jpg
112294,PREMIUM BELGIUM WRAPPED BROWN RECT EYE ALMOND KG,1351214112294,BELGIUM - WRAPPED,135.00,112294.png
112295,PREMIUM BELGIUM WRAPPED BROWN WAFER KG,1351214112295,BELGIUM - WRAPPED,135.00,112295.jpg
112338,PREMIUM BELGIUM WRAPPED BROWN PRALINE HAZWELNUT & TRUFFLE KG,1351214112338,BELGIUM - WRAPPED,135.00,112338.jpg
112480,PREMIUM BELGIUM WRAPPED BROWN GOLDEN BISCUIT KG,1351214112480,BELGIUM - WRAPPED,135.00,112480.jpg
112490,PREMIUM BELGIUM WRAPPED BROWN CHEESECAKE AND STRAWBERRY KG,1351214112490,BELGIUM - WRAPPED,135.00,112490.jpg
112497,PREMIUM BELGIUM WRAPPED BROWN OMAN CHIPS KG,1351214112497,BELGIUM - WRAPPED,135.00,112497.jpg
112533,PREMIUM BELGIUM WRAPPED BROWN SALTY CARAMEL WITH GIANDUIA FILLING,1351214112533,BELGIUM - WRAPPED,135.00,112533.jpg
112534,PREMIUM BELGIUM WRAPPED BROWN PEANUT CARAMEL WITH JANDOYA FILLING KG,1351214112534,BELGIUM - WRAPPED,135.00,112534.jpg
112574,PREMIUM BELGIUM WRAPPED BROWN HAZELNUT CREAM WITH HAZELNUT NUTS KG,1351214112574,BELGIUM - WRAPPED,135.00,112574.jpg
112597,PREMIUM BELGIUM WRAPPED BROWN COTTON CANDY KG,1351214112597,BELGIUM - WRAPPED,135.00,112597.jpg
112598,PREMIUM BELGIUM WRAPPED BROWN CRISPY RICE KG,1351214112598,BELGIUM - WRAPPED,135.00,112598.jpg
112599,PREMIUM BELGIUM WRAPPED BROWN GIANDUJA CARAMEL KG,1351214112599,BELGIUM - WRAPPED,135.00,112599.jpg
112600,PREMIUM BELGIUM WRAPPED BROWN GIANDUJA SUGAR HAZELNUT KG,1351214112600,BELGIUM - WRAPPED,135.00,112600.jpg
112602,PREMIUM BELGIUM WRAPPED BROWN NEW NOUGAT CARAMEL KG,1351214112602,BELGIUM - WRAPPED,135.00,112602.jpg
112604,PREMIUM BELGIUM WRAPPED BROWN NOUGAT TOWEL ALMOND KG,1351214112604,BELGIUM - WRAPPED,135.00,112604.jpg
112606,PREMIUM BELGIUM WRAPPED ROUND BROWN WAFER BISCUIT KG,1351214112606,BELGIUM - WRAPPED,135.00,112606.jpg
112607,PREMIUM BELGIUM WRAPPED BROWN PRALINE CARAMEL KG,1351214112607,BELGIUM - WRAPPED,135.00,112607.jpg
112608,PREMIUM BELGIUM WRAPPED BROWN PISTACHIO NUTS KG,1351214112608,BELGIUM - WRAPPED,135.00,112608.jpg
112609,PREMIUM BELGIUM WRAPPED BROWN PURE PISTACHIO MISKEH KG,1351214112609,BELGIUM - WRAPPED,135.00,112609.jpg
112612,PREMIUM BELGIUM WRAPPED BROWN NOUGAT WITH NUTELLA KG,1351214112612,BELGIUM - WRAPPED,135.00,112612.jpg
112613,PREMIUM BELGIUM WRAPPED BROWN KITKAT KG,1351214112613,BELGIUM - WRAPPED,135.00,112613.jpg
112614,PREMIUM BELGIUM WRAPPED BROWN FINGER CORNFLAKES KG,1351214112614,BELGIUM - WRAPPED,135.00,112614.jpg
112650,PREMIUM BELGIUM WRAPPED BROWN TOWEL ALMOND KG,1351214112650,BELGIUM - WRAPPED,135.00,112650.jpg
112651,PREMIUM BELGIUM WRAPPED BROWN WHITE BISCUIT PISTACHIO KG,1351214112651,BELGIUM - WRAPPED,135.00,112651.jpg
112664,PREMIUM BELGIUM WRAPPED DARK MINI EXTRA KG,1351214112664,BELGIUM - WRAPPED,160.00,112664.jpg
112667,PREMIUM BELGIUM WRAPPED BROWN CHOCO SWIRL TRUFFLE & ALMOND NUTS KG,1351214112667,BELGIUM - WRAPPED,135.00,112667.png
112694,PREMIUM BELGIUM WRAPPED BROWN REGAL BLOCK PISTACHIO & MASTIC KG,1351214112694,BELGIUM - WRAPPED,135.00,112694.jpg
112701,PREMIUM BELGIUM WRAPPED BROWN CHOCO DARK KUNAFA PISTACHIO KG,1351214112701,BELGIUM - WRAPPED,180.00,112701.jpg
112865,PREMIUM BELGIUM WRAPPED GOLD COCONUT CHOCO KG,1351214112865,BELGIUM - WRAPPED,130.00,112865.jpg
112952,PREMIUM BELGIUM WRAPPED BROWN DARK PISTACHIO SQUARE KG,1351214112952,BELGIUM - WRAPPED,135.00,112952.jpg
112953,PREMIUM BELGIUM WRAPPED BROWN DARK HAZELNUT SQUARE KG,1351214112953,BELGIUM - WRAPPED,135.00,112953.jpg
113223,PREMIUM BELGIUM WRAPPED BROWN PECAN COCONUT KG,1351214113223,BELGIUM - WRAPPED,135.00,112584.jpg
113224,PREMIUM BELGIUM WRAPPED BROWN SQUARE PISTACHIO WITH CHOCOLATE PRINT KG,1351214113224,BELGIUM - WRAPPED,170.00,113224.jpg
113225,PREMIUM BELGIUM WRAPPED WHITE SQUARE PISTACHIO WITH CHOCOLATE PRINT KG,1351214113225,BELGIUM - WRAPPED,170.00,113225.jpg
113226,PREMIUM BELGIUM WRAPPED BROWN SQUARE HAZELNUT WITH CHOCOLATE PRINT KG,1351214113226,BELGIUM - WRAPPED,170.00,113226.jpg
113227,PREMIUM BELGIUM WRAPPED WHITE SQUARE HAZELNUT WITH CHOCOLATE PRINT KG,1351214113227,BELGIUM - WRAPPED,170.00,113226.jpg
113228,PREMIUM BELGIUM WRAPPED BROWN SQUARE ALMOND WITH CHOCOLATE PRINT KG,1351214113228,BELGIUM - WRAPPED,170.00,113228.jpg
113229,PREMIUM BELGIUM WRAPPED WHITE SQUARE ALMOND WITH CHOCOLATE PRINT KG,1351214113229,BELGIUM - WRAPPED,170.00,113228.jpg
113230,PREMIUM BELGIUM WRAPPED BROWN SQUARE WAFER WITH CHOCOLATE PRINT KG,1351214113230,BELGIUM - WRAPPED,170.00,113230.jpg
113231,PREMIUM BELGIUM WRAPPED WHITE SQUARE WAFER WITH CHOCOLATE PRINT KG,1351214113231,BELGIUM - WRAPPED,170.00,113230.jpg
113232,PREMIUM BELGIUM WRAPPED BROWN SQUARE PLAIN WITH CHOCOLATE PRINT KG,1351214113232,BELGIUM - WRAPPED,170.00,113232.jpg
113233,PREMIUM BELGIUM WRAPPED WHITE SQUARE PLAIN WITH CHOCOLATE PRINT KG,1351214113233,BELGIUM - WRAPPED,170.00,113232.jpg
113240,PREMIUM BELGIUM WRAPPED BROWN ROUND DIRHAM PISTACHIO WITH CHOCOLATE PRINT KG,1351214113240,BELGIUM - WRAPPED,170.00,113240.jpg
113241,PREMIUM BELGIUM WRAPPED WHITE ROUND DIRHAM PISTACHIO WITH CHOCOLATE PRINT KG,1351214113241,BELGIUM - WRAPPED,170.00,113240.jpg
