Item Code,Item Description,Barcode,Category,Price,Image Filename
112985,PREMIUM BELGIUM OPEN RED RECT STRAWBERRY CHEESECAKE WITH LOTUS POWDER KG,1351214112985,BELGIUM - OPEN,130.00,112985.jpg
112986,PREMIUM BELGIUM OPEN GREEN RECT STRAWBERRY CHEESECAKE WITH LOTUS POWDER KG,1351214112986,BELGIUM - OPEN,130.00,112986.jpg
112987,PREMIUM BELGIUM OPEN GOLD RECT STRAWBERRY CHEESECAKE WITH LOTUS POWDER KG,1351214112987,BELGIUM - OPEN,130.00,112987.jpg
112988,PREMIUM BELGIUM OPEN YELLOW RECT STRAWBERRY CHEESECAKE WITH LOTUS POWDER KG,1351214112988,BELGIUM - OPEN,130.00,112988.jpg
112989,PREMIUM BELGIUM OPEN PURPLE RECT STRAWBERRY CHEESECAKE WITH LOTUS POWDER KG,1351214112989,BELGIUM - OPEN,130.00,112989.jpg
113197,PREMIUM BELGIUM OPEN YELLOW DALLAH COFFEE KG,1351214113197,BELGIUM - OPEN,130.00,111104.jpg
113203,PREMIUM BELGIUM OPEN ORANGE ROSE-FLOWER KG,1351214113203,BELGIUM - OPEN,130.00,111979.jpg
113207,PREMIUM BELGIUM OPEN WHITE STRIPE HAZELNUT KG,1351214113207,BELGIUM - OPEN,130.00,112671.jpg
113208,PREMIUM BELGIUM OPEN BROWN CHOCO JANDOYA CARAMEL KG,1351214113208,BELGIUM - OPEN,130.00,111984.jpg
113209,PREMIUM BELGIUM OPEN BROWN CHOCO HAZELNUT NUTELLA KG,1351214113209,BELGIUM - OPEN,130.00,111983.jpg
113214,PREMIUM BELGIUM OPEN GREEN CARAMEL KG,1351214113214,BELGIUM - OPEN,130.00,113214.jpg
113216,PREMIUM BELGIUM OPEN GOLD DALLAH CARAMEL WITH PISTACHIO CREAM KG,1351214113216,BELGIUM - OPEN,130.00,113216.jpg
113251,PREMIUM BELGIUM OPEN BROWN NOUGAT WITH HAZELNUT NUTS KG,1351214113251,BELGIUM - OPEN,130.00,113250.jpg
113252,PREMIUM BELGIUM OPEN WHITE NOUGAT WITH HAZELNUT NUTS KG,1351214113252,BELGIUM - OPEN,130.00,113250.jpg
113253,PREMIUM BELGIUM OPEN BROWN CORN HAZELNUT WITH JANDOYA KG,1351214113253,BELGIUM - OPEN,130.00,113254.jpg
113254,PREMIUM BELGIUM OPEN GOLD CORN HAZELNUT WITH JANDOYA KG,1351214113254,BELGIUM - OPEN,130.00,113254.jpg
113255,PREMIUM BELGIUM OPEN WHITE CORN HAZELNUT WITH JANDOYA KG,1351214113255,BELGIUM - OPEN,130.00,113254.jpg
113256,PREMIUM BELGIUM OPEN BROWN MOON CARAMEL WITH SESAME KG,1351214113256,BELGIUM - OPEN,130.00,113256.jpg
113257,PREMIUM BELGIUM OPEN WHITE MOON CARAMEL WITH SESAME KG,1351214113257,BELGIUM - OPEN,130.00,113256.jpg
113258,PREMIUM BELGIUM OPEN PURE WHITE MOON CARAMEL WITH SESAME KG,1351214113258,BELGIUM - OPEN,130.00,113258.jpg
113293,PREMIUM BELGIUM OPEN GREEN PISTACHIO WITH PISTACHIO CREAM KG,1351214113293,BELGIUM - OPEN,130.00,113293.jpg
113294,PREMIUM BELGIUM OPEN PINK HEART CARAMEL NUTS WITH PISTACHIO CREAM KG,1351214113294,BELGIUM - OPEN,130.00,113294.jpg
113295,PREMIUM BELGIUM OPEN ORANGE HAZELNUT WITH HAZELNUT CREAM KG,1351214113295,BELGIUM - OPEN,130.00,113295.jpg
113355,PREMIUM BELGIUM OPEN BLUE MOON CARAMEL WITH SESAME KG,1351214113355,BELGIUM - OPEN,130.00,113256.jpg
113356,PREMIUM BELGIUM OPEN PINK MOON CARAMEL WITH SESAME KG,1351214113356,BELGIUM - OPEN,130.00,113256.jpg
113357,PREMIUM BELGIUM OPEN GREEN MOON CARAMEL WITH SESAME KG,1351214113357,BELGIUM - OPEN,130.00,113256.jpg
113358,PREMIUM BELGIUM OPEN PURPLE MOON CARAMEL WITH SESAME KG,1351214113358,BELGIUM - OPEN,130.00,113256.jpg
113421,PREMIUM BELGIUM OPEN GRAY TEAR HAZELNUT KG,1351214113421,BELGIUM - OPEN,130.00,111127.png
113422,PREMIUM BELGIUM OPEN PURPLE TEAR HAZELNUT KG,1351214113422,BELGIUM - OPEN,130.00,111127.png
113423,PREMIUM BELGIUM OPEN SILVER TEAR HAZELNUT KG,1351214113423,BELGIUM - OPEN,130.00,111127.png
113439,PREMIUM BELGIUM OPEN PINK CARAMEL WITH DARK HAZELNUT KG,1351214113439,BELGIUM - OPEN,130.00,113439.png
113440,PREMIUM BELGIUM OPEN PURPLE CARAMEL WITH DARK HAZELNUT KG,1351214113440,BELGIUM - OPEN,130.00,113440.png
113441,PREMIUM BELGIUM OPEN GOLD CARAMEL WITH DARK HAZELNUT KG,1351214113441,BELGIUM - OPEN,130.00,113441.png
113442,PREMIUM BELGIUM OPEN WHITE CARAMEL WITH DARK HAZELNUT KG,1351214113442,BELGIUM - OPEN,130.00,113442.png
113443,PREMIUM BELGIUM OPEN BROWN CARAMEL WITH DARK HAZELNUT KG,1351214113443,BELGIUM - OPEN,130.00,113443.jpg
113444,PREMIUM BELGIUM OPEN OFF WHITE CARAMEL WITH DARK HAZELNUT KG,1351214113444,BELGIUM - OPEN,130.00,113444.png
113445,PREMIUM BELGIUM OPEN GREEN CARAMEL WITH DARK HAZELNUT KG,1351214113445,BELGIUM - OPEN,130.00,113445.png
113446,PREMIUM BELGIUM OPEN BROWN STRAWBERRY CHEESECAKE WITH LOTUS POWDER KG,1351214113446,BELGIUM - OPEN,130.00,113446.jpg
113447,PREMIUM BELGIUM OPEN WHITE STRAWBERRY CHEESECAKE WITH LOTUS POWDER KG,1351214113447,BELGIUM - OPEN,130.00,113447.jpg
113448,PREMIUM BELGIUM OPEN OFF WHITE STRAWBERRY CHEESECAKE WITH LOTUS POWDER KG,1351214113448,BELGIUM - OPEN,130.00,113448.jpg
113449,PREMIUM BELGIUM OPEN PINK STRAWBERRY CHEESECAKE WITH LOTUS POWDER KG,1351214113449,BELGIUM - OPEN,130.00,113449.jpg
113450,PREMIUM BELGIUM OPEN GREEN STRAWBERRY CHEESECAKE WITH LOTUS POWDER KG,1351214113450,BELGIUM - OPEN,130.00,113450.jpg
113451,PREMIUM BELGIUM OPEN GOLD STRAWBERRY CHEESECAKE WITH LOTUS POWDER KG,1351214113451,BELGIUM - OPEN,130.00,113451.jpg
113452,PREMIUM BELGIUM OPEN PURPLE STRAWBERRY CHEESECAKE WITH LOTUS POWDER KG,1351214113452,BELGIUM - OPEN,130.00,113452.jpg
113454,PREMIUM BELGIUM OPEN BROWN CUP ALMOND NUTELLA KG,1351214113454,BELGIUM - OPEN,135.00,113454.jpg
113475,PREMIUM BELGIUM OPEN PINK ROSE-FLOWER WITH ALMOND NOUGAT KG,1351214113475,BELGIUM - OPEN,130.00,113475.jpg
113477,PREMIUM BELGIUM OPEN BROWN ALMOND NOUGAT KG,1351214113477,BELGIUM - OPEN,130.00,113477.jpg
113478,PREMIUM BELGIUM OPEN RED HAZELNUT WITH HAZELNUT NUTS KG,1351214113478,BELGIUM - OPEN,130.00,113478.jpg
113508,PREMIUM BELGIUM OPEN BROWN DIRHAM PISTACHIO NUTS WITH JANDOYA KG,1351214113508,BELGIUM - OPEN,130.00,113508.jpg
113511,PREMIUM BELGIUM OPEN BROWN CUP LOTUS BISCUIT KG,1351214113511,BELGIUM - OPEN,135.00,113511.jpg
113515,PREMIUM BELGIUM OPEN GOLD MOON CARAMEL WITH SESAME KG,1351214113515,BELGIUM - OPEN,130.00,113515.jpg
113516,PREMIUM BELGIUM OPEN TIFFANY BLUE MOON CARAMEL WITH SESAME KG,1351214113516,BELGIUM - OPEN,130.00,113516.jpg
113524,PREMIUM BELGIUM OPEN PURE WHITE WITH DOTS WITH HAZELNUT NUTS CARAMEL NEW NOUGAT KG,1351214113524,BELGIUM - OPEN,130.00,113524.jpg
113525,PREMIUM BELGIUM OPEN TIFFANY BLUE WITH CARAMEL PISTACHIO RICE KG,1351214113525,BELGIUM - OPEN,130.00,113525.jpg
113526,PREMIUM BELGIUM OPEN PURPLE WITH DOTS GOLD STRAWBERRY CHEESECAKE LOTUS KG,1351214113526,BELGIUM - OPEN,130.00,113526.jpg
113527,PREMIUM BELGIUM OPEN GOLD CARAMEL DATES WITH CARDAMON KG,1351214113527,BELGIUM - OPEN,130.00,113527.jpg
113556,PREMIUM BELGIUM OPEN WHITE MOON CARAMEL WITH HAZELNUT CREAM KG,1351214113556,BELGIUM - OPEN,130.00,113556.jpg
113578,PREMIUM BELGIUM OPEN BROWN CARAMEL DATES WITH CARDAMON KG,1351214113578,BELGIUM - OPEN,130.00,113578.jpg
113579,PREMIUM BELGIUM OPEN RED MOON CARAMEL WITH SESAME KG,1351214113579,BELGIUM - OPEN,130.00,113579.jpg
113580,PREMIUM BELGIUM OPEN BLACK MOON CARAMEL WITH SESAME KG,1351214113580,BELGIUM - OPEN,130.00,113580.jpg
113592,PREMIUM BELGIUM OPEN WHITE WITH DOTS WITH HAZELNUT NUTS CARAMEL NEW NOUGAT KG,1351214113592,BELGIUM - OPEN,130.00,113592.jpg
113593,PREMIUM BELGIUM OPEN LIGHT BLUE WITH DOTS WITH HAZELNUT NUTS CARAMEL NEW NOUGAT KG,1351214113593,BELGIUM - OPEN,130.00,113593.jpg
113594,PREMIUM BELGIUM OPEN LIGHT GREEN CARAMEL PISTACHIO CREAM WITH RICE CRISPY KG,1351214113594,BELGIUM - OPEN,130.00,113594.jpg
113595,PREMIUM BELGIUM OPEN BROWN CARAMEL PISTACHIO CREAM WITH RICE CRISPY KG,1351214113595,BELGIUM - OPEN,130.00,113595.jpg
113596,PREMIUM BELGIUM OPEN WHITE CARAMEL PISTACHIO CREAM WITH RICE CRISPY KG,1351214113596,BELGIUM - OPEN,130.00,113596.png
113597,PREMIUM BELGIUM OPEN BLUE CARAMEL PISTACHIO CREAM WITH RICE CRISPY KG,1351214113597,BELGIUM - OPEN,130.00,113597.png
113598,PREMIUM BELGIUM OPEN LIGHT BLUE CARAMEL PISTACHIO CREAM WITH RICE CRISPY KG,1351214113598,BELGIUM - OPEN,130.00,113598.png
113599,PREMIUM BELGIUM OPEN PURE WHITE CARAMEL PISTACHIO CREAM WITH RICE CRISPY KG,1351214113599,BELGIUM - OPEN,130.00,113599.png
113600,PREMIUM BELGIUM OPEN OFF WHITE CARAMEL PISTACHIO CREAM WITH RICE CRISPY KG,1351214113600,BELGIUM - OPEN,130.00,113600.png
113601,PREMIUM BELGIUM OPEN RED CARAMEL PISTACHIO CREAM WITH RICE CRISPY KG,1351214113601,BELGIUM - OPEN,130.00,113601.png
113602,PREMIUM BELGIUM OPEN BLACK CARAMEL PISTACHIO CREAM WITH RICE CRISPY KG,1351214113602,BELGIUM - OPEN,130.00,113602.png
113603,PREMIUM BELGIUM OPEN PINK CARAMEL PISTACHIO CREAM WITH RICE CRISPY KG,1351214113603,BELGIUM - OPEN,130.00,113603.png
113604,PREMIUM BELGIUM OPEN GREEN CARAMEL PISTACHIO CREAM WITH RICE CRISPY KG,1351214113604,BELGIUM - OPEN,130.00,113604.png
113605,PREMIUM BELGIUM OPEN GOLD CARAMEL PISTACHIO CREAM WITH RICE CRISPY KG,1351214113605,BELGIUM - OPEN,130.00,113605.png
113606,PREMIUM BELGIUM OPEN YELLOW CARAMEL PISTACHIO CREAM WITH RICE CRISPY KG,1351214113606,BELGIUM - OPEN,130.00,113606.png
113607,PREMIUM BELGIUM OPEN PURPLE CARAMEL PISTACHIO CREAM WITH RICE CRISPY KG,1351214113607,BELGIUM - OPEN,130.00,113607.png
113608,PREMIUM BELGIUM OPEN GRAY CARAMEL PISTACHIO CREAM WITH RICE CRISPY KG,1351214113608,BELGIUM - OPEN,130.00,113608.png
113609,PREMIUM BELGIUM OPEN TIFFANY  CARAMEL PISTACHIO CREAM WITH RICE CRISPY KG,1351214113609,BELGIUM - OPEN,130.00,113609.png
113610,PREMIUM BELGIUM OPEN SILVER CARAMEL PISTACHIO CREAM WITH RICE CRISPY KG,1351214113610,BELGIUM - OPEN,130.00,113610.png
113611,PREMIUM BELGIUM OPEN MAROON CARAMEL PISTACHIO CREAM WITH RICE CRISPY KG,1351214113611,BELGIUM - OPEN,130.00,113611.png
113612,PREMIUM BELGIUM OPEN ORANGE CARAMEL PISTACHIO CREAM WITH RICE CRISPY KG,1351214113612,BELGIUM - OPEN,130.00,113612.png
113614,PREMIUM BELGIUM OPEN MIXED CARAMEL PISTACHIO CREAM WITH RICE CRISPY KG,1351214113614,BELGIUM - OPEN,130.00,113614.png
113621,PREMIUM BELGIUM OPEN BROWN PISTACHIO KG,1351214113621,BELGIUM - OPEN,130.00,111992.jpg
113624,PREMIUM BELGIUM OPEN BROWN MUG COFFEE KG,1351214113624,BELGIUM - OPEN,130.00,113624.jpg
113628,PREMIUM BELGIUM OPEN WHITE HAZELNUT CREAM WITH NUTS KG,1351214113628,BELGIUM - OPEN,130.00,113628.jpg
113629,PREMIUM BELGIUM OPEN WHITE OVAL HAZELNUT CREAM WITH NUTS KG,1351214113629,BELGIUM - OPEN,130.00,113629.jpg
113630,PREMIUM BELGIUM OPEN PINK STRAWBERRY WITH CHEESE CAKE KG,1351214113630,BELGIUM - OPEN,130.00,113630.jpg
113631,PREMIUM BELGIUM OPEN PINK COTTON CANDY WITH PISTACHIO NUTS KG,1351214113631,BELGIUM - OPEN,130.00,113631.jpg
113665,PREMIUM BELGIUM OPEN BRONZE MOON CARAMEL WITH SESAME KG,1351214113665,BELGIUM - OPEN,130.00,113256.jpg
113666,PREMIUM BELGIUM OPEN PURPLE CARAMEL HAZELNUT WHITE WITH HAZELNUT CREAM KG,1351214113666,BELGIUM - OPEN,130.00,113666.jpg
113667,PREMIUM BELGIUM OPEN PURPLE CARAMEL WALNUT WHITE WITH HAZELNUT KG,1351214113667,BELGIUM - OPEN,130.00,113667.png
113668,PREMIUM BELGIUM OPEN WHITE HAZELNUT NUTS WITH HAZELNUT CREAM KG,1351214113668,BELGIUM - OPEN,130.00,113668.jpg
113669,PREMIUM BELGIUM OPEN GOLD LEAVES CARAMEL HAZELNUT WITH HAZELNUT CREAM KG,1351214113669,BELGIUM - OPEN,130.00,113669.jpg
113670,PREMIUM BELGIUM OPEN PURPLE CARAMEL HAZELNUT WITH HAZELNUT CREAM KG,1351214113670,BELGIUM - OPEN,130.00,113670.jpg
113753,PREMIUM BELGIUM OPEN BROWN ALMOND CARAMEL KG,1351214113753,BELGIUM - OPEN,130.00,112687.jpg
113754,PREMIUM BELGIUM OPEN WHITE ALMOND KG,1351214113754,BELGIUM - OPEN,130.00,112649.jpg
113755,PREMIUM BELGIUM OPEN BROWN NUTELLA HARD KG,1351214113755,BELGIUM - OPEN,130.00,112665.jpg
113758,PREMIUM BELGIUM OPEN BLUE CARAMEL WITH MIX JANDOYA FILLING KG,1351214113758,BELGIUM - OPEN,130.00,113758.jpg
113760,PREMIUM BELGIUM OPEN YELLOW CARAMEL WITH MANGO FILLING KG,1351214113760,BELGIUM - OPEN,130.00,113760.jpg
113761,PREMIUM BELGIUM OPEN PINK STRAWBERRY WITH LOTUS POWDER KG,1351214113761,BELGIUM - OPEN,130.00,113761.jpg
113763,PREMIUM BELGIUM OPEN BROWN CARAMEL WITH WALNUT FILLING KG,1351214113763,BELGIUM - OPEN,130.00,113763.jpg
113764,PREMIUM BELGIUM OPEN WHITE CARAMEL WITH WALNUT FILLING KG,1351214113764,BELGIUM - OPEN,130.00,113764.jpg
113765,PREMIUM BELGIUM OPEN GOLD CARAMEL WITH WALNUT FILLING KG,1351214113765,BELGIUM - OPEN,130.00,113765.jpg
113766,PREMIUM BELGIUM OPEN BROWN CARAMEL WALNUT WHITE WITH HAZELNUT KG,1351214113766,BELGIUM - OPEN,130.00,113766.jpg
113767,PREMIUM BELGIUM OPEN WHITE CARAMEL WALNUT WHITE WITH HAZELNUT KG,1351214113767,BELGIUM - OPEN,130.00,113767.jpg
113769,PREMIUM BELGIUM OPEN GOLD DALLAH PISTACHIO NUTS WITH PISTACHIO CREAM KG,1351214113769,BELGIUM - OPEN,130.00,113769.jpg
113772,PREMIUM BELGIUM OPEN BROWN NUTELLA WITH HAZELNUT NUTS KG,1351214113772,BELGIUM - OPEN,130.00,113772.jpg
113773,PREMIUM BELGIUM OPEN WHITE NUTELLA WITH HAZELNUT NUTS KG,1351214113773,BELGIUM - OPEN,130.00,113773.png
113774,PREMIUM BELGIUM OPEN WHITE FEUILLETINE KG,1351214113774,BELGIUM - OPEN,130.00,113774.jpg
113775,PREMIUM BELGIUM BROWN WHITE FEUILLETINE KG,1351214113775,BELGIUM - OPEN,130.00,113775.jpg
113776,PREMIUM BELGIUM BROWN CARAMEL KG,1351214113776,BELGIUM - OPEN,130.00,113776.jpg
113777,PREMIUM BELGIUM WHITE CARAMEL KG,1351214113777,BELGIUM - OPEN,130.00,113777.jpg
113895,PREMIUM BELGIUM OPEN BROWN RAHASH WITH PISTACHIO NUTS KG,1351214113895,BELGIUM - OPEN,130.00,113895.jpg
114007,PREMIUM BELGIUM OPEN BROWN JANDOYA FILLING KG,1351214114007,BELGIUM - OPEN,130.00,114007.jpg
114008,PREMIUM BELGIUM OPEN BROWN MOON JANDOYA FILLING KG,1351214114008,BELGIUM - OPEN,130.00,114008.jpg
114009,PREMIUM BELGIUM OPEN BROWN SQUARE JANDOYA FILLING KG,1351214114009,BELGIUM - OPEN,130.00,114009.jpg
114010,PREMIUM BELGIUM OPEN BROWN JANDOYA WITH SLICED ALMOND KG,1351214114010,BELGIUM - OPEN,130.00,114010.jpg
114011,PREMIUM BELGIUM OPEN WHITE MUG COFFEE KG,1351214114011,BELGIUM - OPEN,130.00,114011.jpg
114117,PREMIUM BELGIUM OPEN WHITE CARAMEL WITH CREAM PISTACHIO AND CRISPY KG,1351214114117,BELGIUM - OPEN,130.00,112544.jpg
114135,PREMIUM BELGIUM OPEN BROWN ROSE-FLOWER HAZELNUT NUTS WITH HAZELNUT CREAM  KG,1351214114135,BELGIUM - OPEN,130.00,114135.jpg
114136,PREMIUM BELGIUM OPEN GOLD ROSE-FLOWER HAZELNUT NUTS WITH HAZELNUT CREAM  KG,1351214114136,BELGIUM - OPEN,130.00,114136.png
114137,PREMIUM BELGIUM OPEN PINK NUTELLA WITH HAZELNUT KG,1351214114137,BELGIUM - OPEN,130.00,114137.jpg
114181,PREMIUM BELGIUM OPEN WHITE STRAWBERRY CHEESE CAKE WITH LOTUS KG,1351214114181,BELGIUM - OPEN,130.00,114181.jpg
114185,PREMIUM BELGIUM OPEN PURE WHITE LOTUS FILLING KG,1351214114185,BELGIUM - OPEN,135.00,114185.jpg
114186,PREMIUM BELGIUM OPEN BROWN LOTUS FILLING KG,1351214114186,BELGIUM - OPEN,135.00,114186.jpg
114191,PREMIUM BELGIUM OPEN BROWN MILK NUTELLA WITH KINDER AND ALMOND NUTS KG,1351214114191,BELGIUM - OPEN,130.00,114191.jpg
114199,PREMIUM BELGIUM OPEN BROWN CUP NUTELLA HAZELNUT KG,1351214114199,BELGIUM - OPEN,130.00,114199.jpg
114216,PREMIUM BELGIUM OPEN BROWN CARAMEL WITH GIANDUIA FILLING,1351214114216,BELGIUM - OPEN,130.00,114216.jpg
114217,PREMIUM BELGIUM OPEN GOLD CARAMEL WITH GIANDUIA FILLING,1351214114217,BELGIUM - OPEN,130.00,114216.jpg
114218,PREMIUM BELGIUM OPEN PURE WHITE CARAMEL WITH GIANDUIA FILLING,1351214114218,BELGIUM - OPEN,130.00,114218.jpg
114223,PREMIUM BELGIUM OPEN BROWN HAZELNUT FILLING KG,1351214114223,BELGIUM - OPEN,130.00,114223.jpg
114224,PREMIUM BELGIUM OPEN BROWN HAZELNUT CROQUANT KG,1351214114224,BELGIUM - OPEN,130.00,114224.jpg
110944,PREMIUM BELGIUM WRAPPED BROWN PISTACHIO KUNAFA KG,1351214110944,BELGIUM - WRAPPED,180.00,110944.jpg
111086,PREMIUM BELGIUM WRAPPED BROWN REGAL SQUARE PISTACHIO & MASTIC KG,1351214111086,BELGIUM - WRAPPED,135.00,111086.jpg
111087,PREMIUM BELGIUM WRAPPED BROWN ROYAL SEAL NOUGAT & ALMONDS KG,1351214111087,BELGIUM - WRAPPED,135.00,111087.jpg
111088,PREMIUM BELGIUM WRAPPED BROWN BLISS SQUARE GIANDUJA & CARAMEL & HAZELNUTS KG,1351214111088,BELGIUM - WRAPPED,135.00,111088.jpg
111089,"PREMIUM BELGIUM WRAPPED BROWN PARIS HAZELNUT PRALINE & HONEY, CARAMEL & HAZELNUTS & COFFEE KG",1351214111089,BELGIUM - WRAPPED,135.00,111089.jpg
111090,PREMIUM BELGIUM WRAPPED BROWN CHOCO MAP SAFFRON & PISTACHIO KG,1351214111090,BELGIUM - WRAPPED,135.00,111090.png
111091,PREMIUM BELGIUM WRAPPED BROWN TRIO HARMONY A HAZELNUT & CARAMEL KG,1351214111091,BELGIUM - WRAPPED,135.00,111091.png
111092,PREMIUM BELGIUM WRAPPED BROWN CHOCO TEAR GIANDUJA & CARAMEL & FEUILLETINE  & NUTS & HAZELNUTS KG,1351214111092,BELGIUM - WRAPPED,135.00,111092.jpg
111093,PREMIUM BELGIUM WRAPPED WHITE CHOCO RIPPLE CUP CARAMEL & CREAM KG,1351214111093,BELGIUM - WRAPPED,135.00,111093.png
111094,PREMIUM BELGIUM WRAPPED BROWN CHOCO SQUIRREL CHEESECAKE & STRAWBERRIES  & BISCUIT KG,1351214111094,BELGIUM - WRAPPED,135.00,111094.png
111095,PREMIUM BELGIUM WRAPPED BROWN DIRHAM NUTELLA & HAZELNUTS KG,1351214111095,BELGIUM - WRAPPED,135.00,111095.jpg
111096,PREMIUM BELGIUM WRAPPED BROWN CHOCO MATRESS GIANDUJA & NUTS & FEUILLETINE KG,1351214111096,BELGIUM - WRAPPED,135.00,111096.jpg
111097,PREMIUM BELGIUM WRAPPED BROWN CHOCO SQUIRREL HAZELNUT NOUGAT & ALMONDS & CARAMEL KG,1351214111097,BELGIUM - WRAPPED,135.00,111097.jpg
111098,PREMIUM BELGIUM WRAPPED BROWN GOLDEN LINE HAZELNUT GIANDUJA & CARAMEL KG,1351214111098,BELGIUM - WRAPPED,135.00,111098.png
111099,PREMIUM BELGIUM WRAPPED BROWN CHOCO BALL HAZELNUT PASTE KG,1351214111099,BELGIUM - WRAPPED,135.00,111099.jpg
111100,PREMIUM BELGIUM WRAPPED WHITE MUSHROOM NOUGAT & MIXED NUTS &  HAZELNUTS & GIANDUJA KG,1351214111100,BELGIUM - WRAPPED,135.00,111100.png
111101,PREMIUM BELGIUM WRAPPED BROWN ROYAL BAR FEUILLETINE BISCUIT & CHOCOLATE KG,1351214111101,BELGIUM - WRAPPED,135.00,111101.jpg
111102,PREMIUM BELGIUM WRAPPED BROWN ROYAL CARAMEL BAR  CARAMEL & CHOCOLATE KG,1351214111102,BELGIUM - WRAPPED,135.00,111102.jpg
111103,PREMIUM BELGIUM WRAPPED BROWN HAZEL CROWN NUTELLA & HAZELNUTS KG,1351214111103,BELGIUM - WRAPPED,135.00,111103.jpg
111104,PREMIUM BELGIUM WRAPPED BROWN DALLAH COFFEE KG,1351214111104,BELGIUM - WRAPPED,135.00,111104.jpg
111110,PREMIUM BELGIUM WRAPPED BROWN CHOCO DOME CHEESECAKE & STRAWBERRIES KG,1351214111110,BELGIUM - WRAPPED,135.00,111110.jpg
111111,PREMIUM BELGIUM WRAPPED BROWN HAZELNUT PES HAZELNUT PRALINE & TRUFFLE & WHOLE HAZELNUT KG,1351214111111,BELGIUM - WRAPPED,135.00,111111.png
111112,PREMIUM BELGIUM WRAPPED BROWN ANDALUSIA GIANDUJA & CARAMEL & CRISPY KG,1351214111112,BELGIUM - WRAPPED,135.00,111112.png
111114,PREMIUM BELGIUM WRAPPED BROWN CHOCO BRICK PRALINE SESAME & CARAMEL KG,1351214111114,BELGIUM - WRAPPED,135.00,111114.png
111115,PREMIUM BELGIUM WRAPPED BROWN GOLDEN LINE PEANUT & CARAMEL KG,1351214111115,BELGIUM - WRAPPED,135.00,111115.png
111116,PREMIUM BELGIUM WRAPPED BROWN CHOCO RING OREO BISCUIT FILLING KG,1351214111116,BELGIUM - WRAPPED,135.00,111116.jpg
111117,PREMIUM BELGIUM WRAPPED WHITE CHOCO SQUIRREL COFFEE FILLING & CREAM KG,1351214111117,BELGIUM - WRAPPED,135.00,111117.png
111118,PREMIUM BELGIUM WRAPPED BROWN HEART HAZELNUT GIANDUJA & ALMOND NUTS KG,1351214111118,BELGIUM - WRAPPED,135.00,111118.jpg
111119,PREMIUM BELGIUM WRAPPED BROWN CHOCO SWIRL TRUFFLE & PISTACHIO NUTS KG,1351214111119,BELGIUM - WRAPPED,135.00,111119.jpg
111120,PREMIUM BELGIUM WRAPPED BROWN SNOW HOUSE CHOCOLATE & NUTS & PISTACHIO KG,1351214111120,BELGIUM - WRAPPED,135.00,111120.jpg
111122,PREMIUM BELGIUM WRAPPED BROWN LULU CUP CUP OF KIBANDER & LULU PIECE KG,1351214111122,BELGIUM - WRAPPED,135.00,111122.jpg
111124,PREMIUM BELGIUM WRAPPED BROWN PISTACHIO LUXE PISTACHIO KG,1351214111124,BELGIUM - WRAPPED,135.00,111124.jpg
111125,PREMIUM BELGIUM WRAPPED BROWN RUBY PRISM GIANDUJA & CARAMEL KG,1351214111125,BELGIUM - WRAPPED,135.00,111125.jpg
111126,PREMIUM BELGIUM WRAPPED BROWN PISTACHIO LEAF PISTACHIO & CRISPY & CARAMEL KG,1351214111126,BELGIUM - WRAPPED,135.00,111126.png
111127,PREMIUM BELGIUM WRAPPED PINK TEAR HAZELNUT KG,1351214111127,BELGIUM - WRAPPED,135.00,111127.png
111128,PREMIUM BELGIUM WRAPPED WHITE PISTACHIO ROSE PISTACHIO ROSE KG,1351214111128,BELGIUM - WRAPPED,135.00,111128.jpg
111129,PREMIUM BELGIUM WRAPPED BROWN CARAMEL ALMOND HAZELNUT FILLING KG,1351214111129,BELGIUM - WRAPPED,135.00,111129.png
111130,PREMIUM BELGIUM WRAPPED BROWN CHOCO SQUIRREL PLAIN & BELGIAN KG,1351214111130,BELGIUM - WRAPPED,135.00,111130.jpg
111135,PREMIUM BELGIUM WRAPPED BROWN PARIS PLAIN KG,1351214111135,BELGIUM - WRAPPED,135.00,111135.png
111136,PREMIUM BELGIUM WRAPPED BROWN CHOCO PLAIN SQUARE PLAIN KG,1351214111136,BELGIUM - WRAPPED,135.00,111136.jpg
111137,PREMIUM BELGIUM WRAPPED BROWN CHOCO WAFER SQUARE WAFER KG,1351214111137,BELGIUM - WRAPPED,135.00,111137.jpg
111138,PREMIUM BELGIUM WRAPPED BROWN CHOCO PISTACHIO SQUARE PISTACHIO KG,1351214111138,BELGIUM - WRAPPED,135.00,111138.jpg
111139,PREMIUM BELGIUM WRAPPED BROWN CHOCO HAZELNUT SQUARE  HAZELNUT CREAM WITH NUTS KG,1351214111139,BELGIUM - WRAPPED,135.00,111139.jpg
111140,PREMIUM BELGIUM WRAPPED BROWN CHOCO CRISPY SQUARE CRISPY KG,1351214111140,BELGIUM - WRAPPED,135.00,111140.jpg
111142,PREMIUM BELGIUM WRAPPED BROWN CHOCO ALMOND SQUARE ALMOND CREAM WITH NUTS KG,1351214111142,BELGIUM - WRAPPED,135.00,111142.jpg
111461,PREMIUM BELGIUM WRAPPED BROWN CHOCO RIPPLE CUP CARAMEL & CREAM KG,1351214111461,BELGIUM - WRAPPED,135.00,111093.png
111462,PREMIUM BELGIUM WRAPPED BROWN MUSHROOM NOUGAT & MIXED NUTS &  HAZELNUTS & GIANDUJA KG,1351214111462,BELGIUM - WRAPPED,135.00,111100.png
111463,PREMIUM BELGIUM WRAPPED BROWN CHOCO SQUIRREL COFFEE FILLING & CREAM KG,1351214111463,BELGIUM - WRAPPED,135.00,111463.jpg
111470,PREMIUM BELGIUM WRAPPED BROWN HEART PRALINE HAZELNUT CARAMEL KG,1351214111470,BELGIUM - WRAPPED,135.00,111470.jpg
111471,PREMIUM BELGIUM WRAPPED BROWN HAZELNUT CARAMEL KG,1351214111471,BELGIUM - WRAPPED,135.00,111471.jpg
111472,PREMIUM BELGIUM WRAPPED BROWN SQUARE WITH LOTUS KG,1351214111472,BELGIUM - WRAPPED,135.00,111472.png
111473,PREMIUM BELGIUM WRAPPED BROWN CORNFLAKES KG,1351214111473,BELGIUM - WRAPPED,135.00,111473.jpg
111480,PREMIUM BELGIUM WRAPPED WHITE CORNFLAKES KG,1351214111480,BELGIUM - WRAPPED,135.00,111473.jpg
111481,PREMIUM BELGIUM WRAPPED WHITE HAZELNUT CARAMEL KG,1351214111481,BELGIUM - WRAPPED,135.00,111311.jpg
111482,PREMIUM BELGIUM WRAPPED WHITE HEART PRALINE HAZELNUT CARAMEL KG,1351214111482,BELGIUM - WRAPPED,135.00,111281.jpg
111483,PREMIUM BELGIUM WRAPPED WHITE SQUARE WITH LOTUS KG,1351214111483,BELGIUM - WRAPPED,135.00,111483.png
111484,PREMIUM BELGIUM WRAPPED WHITE ANDALUSIA GIANDUJA & CARAMEL & CRISPY KG,1351214111484,BELGIUM - WRAPPED,135.00,111112.png
111485,PREMIUM BELGIUM WRAPPED WHITE BLISS SQUARE GIANDUJA & CARAMEL & HAZELNUTS KG,1351214111485,BELGIUM - WRAPPED,135.00,111088.jpg
111486,PREMIUM BELGIUM WRAPPED WHITE CHOCO ALMOND SQUARE ALMOND KG,1351214111486,BELGIUM - WRAPPED,135.00,111486.jpg
111487,PREMIUM BELGIUM WRAPPED WHITE CHOCO BALL HAZELNUT PASTE KG,1351214111487,BELGIUM - WRAPPED,135.00,111099.jpg
111488,PREMIUM BELGIUM WRAPPED WHITE CHOCO BRICK PRALINE SESAME & CARAMEL KG,1351214111488,BELGIUM - WRAPPED,135.00,111114.png
111489,PREMIUM BELGIUM WRAPPED WHITE CHOCO CRISPY SQUARE CRISPY KG,1351214111489,BELGIUM - WRAPPED,135.00,111140.jpg
111490,PREMIUM BELGIUM WRAPPED WHITE CHOCO DOME CHEESECAKE & STRAWBERRIES KG,1351214111490,BELGIUM - WRAPPED,135.00,111110.jpg
111491,PREMIUM BELGIUM WRAPPED WHITE CHOCO HAZELNUT SQUARE  HAZELNUT KG,1351214111491,BELGIUM - WRAPPED,135.00,111491.png
111492,PREMIUM BELGIUM WRAPPED WHITE PISTACHIO KUNAFA KG,1351214111492,BELGIUM - WRAPPED,180.00,110944.jpg
111493,PREMIUM BELGIUM WRAPPED WHITE CHOCO MAP SAFFRON & PISTACHIO KG,1351214111493,BELGIUM - WRAPPED,135.00,111090.png
111494,PREMIUM BELGIUM WRAPPED WHITE CHOCO MATRESS GIANDUJA & NUTS & FEUILLETINE KG,1351214111494,BELGIUM - WRAPPED,135.00,111096.jpg
111495,PREMIUM BELGIUM WRAPPED WHITE CHOCO PISTACHIO SQUARE PISTACHIO KG,1351214111495,BELGIUM - WRAPPED,135.00,111138.jpg
111496,PREMIUM BELGIUM WRAPPED WHITE CHOCO PLAIN SQUARE PLAIN KG,1351214111496,BELGIUM - WRAPPED,135.00,111136.jpg
111497,PREMIUM BELGIUM WRAPPED WHITE CHOCO RING OREO BISCUIT FILLING KG,1351214111497,BELGIUM - WRAPPED,135.00,111116.jpg
111498,PREMIUM BELGIUM WRAPPED WHITE CHOCO SQUIRREL CHEESECAKE & STRAWBERRIES  & BISCUIT KG,1351214111498,BELGIUM - WRAPPED,135.00,111094.png
111499,PREMIUM BELGIUM WRAPPED WHITE CHOCO SQUIRREL HAZELNUT NOUGAT & ALMONDS & CARAMEL KG,1351214111499,BELGIUM - WRAPPED,135.00,111097.jpg
111500,PREMIUM BELGIUM WRAPPED WHITE CHOCO SQUIRREL PLAIN & BELGIAN KG,1351214111500,BELGIUM - WRAPPED,135.00,111130.jpg
111501,PREMIUM BELGIUM WRAPPED WHITE CHOCO SWIRL TRUFFLE & PISTACHIO NUTS KG,1351214111501,BELGIUM - WRAPPED,135.00,111119.jpg
111502,PREMIUM BELGIUM WRAPPED WHITE CHOCO TEAR GIANDUJA & CARAMEL & FEUILLETINE  & NUTS & HAZELNUTS KG,1351214111502,BELGIUM - WRAPPED,135.00,111092.jpg
111503,PREMIUM BELGIUM WRAPPED WHITE CHOCO WAFER SQUARE WAFER KG,1351214111503,BELGIUM - WRAPPED,135.00,111137.jpg
111505,PREMIUM BELGIUM WRAPPED WHITE DALLAH COFFEE KG,1351214111505,BELGIUM - WRAPPED,135.00,111104.jpg
111506,PREMIUM BELGIUM WRAPPED WHITE DIRHAM NUTELLA & HAZELNUTS KG,1351214111506,BELGIUM - WRAPPED,135.00,111095.jpg
111507,PREMIUM BELGIUM WRAPPED WHITE GOLDEN LINE HAZELNUT GIANDUJA & CARAMEL KG,1351214111507,BELGIUM - WRAPPED,135.00,111098.png
111508,PREMIUM BELGIUM WRAPPED WHITE GOLDEN LINE PEANUT & CARAMEL KG,1351214111508,BELGIUM - WRAPPED,135.00,111115.png
111509,PREMIUM BELGIUM WRAPPED WHITE HAZEL CROWN NUTELLA & HAZELNUTS KG,1351214111509,BELGIUM - WRAPPED,135.00,111103.jpg
111510,PREMIUM BELGIUM WRAPPED WHITE HAZELNUT PES HAZELNUT PRALINE & TRUFFLE & WHOLE HAZELNUT KG,1351214111510,BELGIUM - WRAPPED,135.00,111111.png
111511,PREMIUM BELGIUM WRAPPED WHITE HEART HAZELNUT GIANDUJA & ALMOND NUTS KG,1351214111511,BELGIUM - WRAPPED,135.00,111118.jpg
111512,PREMIUM BELGIUM WRAPPED WHITE LULU CUP CUP OF KIBANDER & LULU PIECE KG,1351214111512,BELGIUM - WRAPPED,135.00,111122.jpg
111518,"PREMIUM BELGIUM WRAPPED WHITE PARIS HAZELNUT PRALINE & HONEY, CARAMEL & HAZELNUTS & COFFEE KG",1351214111518,BELGIUM - WRAPPED,135.00,111089.jpg
111519,PREMIUM BELGIUM WRAPPED WHITE PARIS PLAIN KG,1351214111519,BELGIUM - WRAPPED,135.00,111135.png
