Item Code,Item Description,Barcode,Category,Price,Image Filename
113242,PREMIUM BELGIUM WRAPPED BROWN ROUND DIRHAM HAZELNUT WITH CHOCOLATE PRINT KG,1351214113242,BELGIUM - WRAPPED,170.00,113242.jpg
113243,PREMIUM BELGIUM WRAPPED WHITE ROUND DIRHAM HAZELNUT WITH CHOCOLATE PRINT KG,1351214113243,BELGIUM - WRAPPED,170.00,113242.jpg
113244,PREMIUM BELGIUM WRAPPED BROWN ROUND DIRHAM ALMOND WITH CHOCOLATE PRINT KG,1351214113244,BELGIUM - WRAPPED,170.00,113244.png
113245,PREMIUM BELGIUM WRAPPED WHITE ROUND DIRHAM ALMOND WITH CHOCOLATE PRINT KG,1351214113245,BELGIUM - WRAPPED,170.00,113245.jpg
113246,PREMIUM BELGIUM WRAPPED BROWN ROUND DIRHAM PLAIN CHOCOLATE WITH CHOCOLATE PRINT KG,1351214113246,BELGIUM - WRAPPED,170.00,113246.jpg
113247,PREMIUM BELGIUM WRAPPED WHITE ROUND DIRHAM PLAIN CHOCOLATE WITH CHOCOLATE PRINT KG,1351214113247,BELGIUM - WRAPPED,170.00,113247.jpg
113250,PREMIUM BELGIUM WRAPPED BROWN NOUGAT WITH HAZELNUT NUTS KG,1351214113250,BELGIUM - WRAPPED,135.00,113250.jpg
113297,PREMIUM BELGIUM WRAPPED WHITE PECAN COCONUT KG,1351214113297,BELGIUM - WRAPPED,135.00,112584.jpg
113298,PREMIUM BELGIUM WRAPPED GOLD PECAN COCONUT KG,1351214113298,BELGIUM - WRAPPED,135.00,112584.jpg
113311,PREMIUM BELGIUM WRAPPED BROWN BABY TROLLEY ALMOND CHOCO PRINT KG,1351214113311,BELGIUM - WRAPPED,170.00,113311.jpg
113312,PREMIUM BELGIUM WRAPPED BROWN BABY TROLLEY PISTACHIO CHOCO PRINT KG,1351214113312,BELGIUM - WRAPPED,170.00,113312.jpg
113313,PREMIUM BELGIUM WRAPPED BROWN BABY TROLLEY HAZELNUT CHOCO PRINT KG,1351214113313,BELGIUM - WRAPPED,170.00,113313.jpg
113314,PREMIUM BELGIUM WRAPPED BROWN BABY TROLLEY PLAIN CHOCOLATE WITH CHOCO PRINT KG,1351214113314,BELGIUM - WRAPPED,170.00,113314.jpg
113315,PREMIUM BELGIUM WRAPPED BROWN SQUARE AND HEART ALMOND CHOCO PRINT KG,1351214113315,BELGIUM - WRAPPED,170.00,113315.jpg
113316,PREMIUM BELGIUM WRAPPED BROWN SQUARE AND HEART PISTACHIO CHOCO PRINT KG,1351214113316,BELGIUM - WRAPPED,170.00,113316.jpg
113317,PREMIUM BELGIUM WRAPPED BROWN SQUARE AND HEART HAZELNUT CHOCO PRINT KG,1351214113317,BELGIUM - WRAPPED,170.00,113317.jpg
113318,PREMIUM BELGIUM WRAPPED BROWN SQUARE AND HEART PLAIN CHOCOLATE WITH CHOCO PRINT KG,1351214113318,BELGIUM - WRAPPED,170.00,113318.jpg
113319,PREMIUM BELGIUM WRAPPED BROWN HEART ALMOND CHOCO PRINT KG,1351214113319,BELGIUM - WRAPPED,170.00,113319.jpg
113320,PREMIUM BELGIUM WRAPPED BROWN HEART PISTACHIO CHOCO PRINT KG,1351214113320,BELGIUM - WRAPPED,170.00,113320.jpg
113321,PREMIUM BELGIUM WRAPPED BROWN HEART HAZELNUT CHOCO PRINT KG,1351214113321,BELGIUM - WRAPPED,170.00,113321.jpg
113322,PREMIUM BELGIUM WRAPPED BROWN HEART PLAIN CHOCOLATE WITH CHOCO PRINT KG,1351214113322,BELGIUM - WRAPPED,170.00,113322.jpg
113323,PREMIUM BELGIUM WRAPPED BROWN BABY DRESS ALMOND CHOCO PRINT KG,1351214113323,BELGIUM - WRAPPED,170.00,113323.jpg
113324,PREMIUM BELGIUM WRAPPED BROWN BABY DRESS PISTACHIO CHOCO PRINT KG,1351214113324,BELGIUM - WRAPPED,170.00,113324.jpg
113325,PREMIUM BELGIUM WRAPPED BROWN BABY DRESS HAZELNUT CHOCO PRINT KG,1351214113325,BELGIUM - WRAPPED,170.00,113325.jpg
113326,PREMIUM BELGIUM WRAPPED BROWN BABY DRESS PLAIN CHOCOLATE WITH CHOCO PRINT KG,1351214113326,BELGIUM - WRAPPED,170.00,113326.jpg
113328,PREMIUM BELGIUM WRAPPED WHITE BABY TROLLEY ALMOND CHOCO PRINT KG,1351214113328,BELGIUM - WRAPPED,170.00,113311.jpg
113329,PREMIUM BELGIUM WRAPPED WHITE BABY TROLLEY PISTACHIO CHOCO PRINT KG,1351214113329,BELGIUM - WRAPPED,170.00,113329.png
113330,PREMIUM BELGIUM WRAPPED WHITE BABY TROLLEY HAZELNUT CHOCO PRINT KG,1351214113330,BELGIUM - WRAPPED,170.00,113330.jpg
113331,PREMIUM BELGIUM WRAPPED WHITE BABY TROLLEY PLAIN CHOCOLATE WITH CHOCO PRINT KG,1351214113331,BELGIUM - WRAPPED,170.00,113331.jpg
113332,PREMIUM BELGIUM WRAPPED WHITE SQUARE AND HEART ALMOND CHOCO PRINT KG,1351214113332,BELGIUM - WRAPPED,170.00,113315.jpg
113333,PREMIUM BELGIUM WRAPPED WHITE SQUARE AND HEART PISTACHIO CHOCO PRINT KG,1351214113333,BELGIUM - WRAPPED,170.00,113333.jpg
113334,PREMIUM BELGIUM WRAPPED WHITE SQUARE AND HEART HAZELNUT CHOCO PRINT KG,1351214113334,BELGIUM - WRAPPED,170.00,113334.jpg
113335,PREMIUM BELGIUM WRAPPED WHITE SQUARE AND HEART PLAIN CHOCOLATE WITH CHOCO PRINT KG,1351214113335,BELGIUM - WRAPPED,170.00,113335.jpg
113336,PREMIUM BELGIUM WRAPPED WHITE HEART ALMOND CHOCO PRINT KG,1351214113336,BELGIUM - WRAPPED,170.00,113319.jpg
113337,PREMIUM BELGIUM WRAPPED WHITE HEART PISTACHIO CHOCO PRINT KG,1351214113337,BELGIUM - WRAPPED,170.00,113337.jpg
113338,PREMIUM BELGIUM WRAPPED WHITE HEART HAZELNUT CHOCO PRINT KG,1351214113338,BELGIUM - WRAPPED,170.00,113338.jpg
113339,PREMIUM BELGIUM WRAPPED WHITE HEART PLAIN CHOCOLATE WITH CHOCO PRINT KG,1351214113339,BELGIUM - WRAPPED,170.00,113339.jpg
113340,PREMIUM BELGIUM WRAPPED WHITE BABY DRESS ALMOND CHOCO PRINT KG,1351214113340,BELGIUM - WRAPPED,170.00,113323.jpg
113341,PREMIUM BELGIUM WRAPPED WHITE BABY DRESS PISTACHIO CHOCO PRINT KG,1351214113341,BELGIUM - WRAPPED,170.00,113341.jpg
113342,PREMIUM BELGIUM WRAPPED WHITE BABY DRESS HAZELNUT CHOCO PRINT KG,1351214113342,BELGIUM - WRAPPED,170.00,113342.jpg
113343,PREMIUM BELGIUM WRAPPED WHITE BABY DRESS PLAIN CHOCOLATE WITH CHOCO PRINT KG,1351214113343,BELGIUM - WRAPPED,170.00,113343.jpg
113347,PREMIUM BELGIUM WRAPPED BROWN DARK CHOCOLATE WITH ALMOND NUTS KG,1351214113347,BELGIUM - WRAPPED,135.00,113347.jpg
113348,PREMIUM BELGIUM WRAPPED BROWN DARK CHOCOLATE WITH PISTACHIO NUTS KG,1351214113348,BELGIUM - WRAPPED,135.00,113348.jpg
113349,PREMIUM BELGIUM WRAPPED BROWN DARK CHOCOLATE WITH HAZELNUT NUTS KG,1351214113349,BELGIUM - WRAPPED,135.00,113349.jpg
113409,PREMIUM BELGIUM WRAPPED BROWN SALTY CARAMEL KG,1351214113409,BELGIUM - WRAPPED,135.00,113409.jpg
113410,PREMIUM BELGIUM WRAPPED BROWN RAHASH KG,1351214113410,BELGIUM - WRAPPED,135.00,113410.jpg
113617,PREMIUM BELGIUM WRAPPED BROWN SQUARE ZAFRAN CARAMEL KG,1351214113617,BELGIUM - WRAPPED,135.00,113617.png
113779,PREMIUM BELGIUM WRAPPED BROWN MILK CHOCOLATE WITH HAZELNUT NUTS KG,1351214113779,BELGIUM - WRAPPED,135.00,113779.jpg
113780,PREMIUM BELGIUM WRAPPED BROWN MILK CHOCOLATE WITH PISTACHIO NUTS KG,1351214113780,BELGIUM - WRAPPED,135.00,113780.jpg
113781,PREMIUM BELGIUM WRAPPED BROWN MILK CHOCOLATE WITH ALMOND NUTS KG,1351214113781,BELGIUM - WRAPPED,135.00,113781.jpg
114183,PREMIUM BELGIUM WRAPPED WHITE CARAMEL WITH LOTUS FILL KG,1351214114183,BELGIUM - WRAPPED,135.00,114183.jpg
114184,PREMIUM BELGIUM WRAPPED BROWN CARAMEL WITH LOTUS FILL KG,1351214114184,BELGIUM - WRAPPED,135.00,114183.jpg
100248,PREMIUM BELGIUM WRAPPED BROWN MINI EXTRA KG,1351214100248,BELGIUM - WRAPPED,170.00,100248.jpg
112034,PREMIUM AIN JAMAL CARAMEL KG,1351214112034,FINI- AIN AL JAMAL,90.00,112034.png
112035,PREMIUM AIN JAMAL NUTTELA KG,1351214112035,FINI- AIN AL JAMAL,90.00,112035.png
112036,PREMIUM AIN JAMAL ZAFRAN KG,1351214112036,FINI- AIN AL JAMAL,90.00,112036.png
112037,PREMIUM AIN JAMAL PISTACHIO KG,1351214112037,FINI- AIN AL JAMAL,90.00,112037.png
112089,PREMIUM AIN JAMAL LOTUS KG,1351214112089,FINI- AIN AL JAMAL,90.00,112089.jpg
112356,PREMIUM AIN JAMAL OREO KG,1351214112356,FINI- AIN AL JAMAL,90.00,112356.jpg
112357,PREMIUM AIN JAMAL RED VELVET KG,1351214112357,FINI- AIN AL JAMAL,90.00,112357.jpg
100230,HAPPY BALL PISTACHIO CHOCOLATE PC,1351214003387,FINI- ASSORTED,6.00,100230.jpg
100249,CHOCOLATE MARSHMALLOW BALL,1351214005226,FINI- ASSORTED,4.80,100249.jpg
100256,ARAMISH PISTACHIO KG,1351214005467,FINI- ASSORTED,160.00,100256.jpg
106412,GHR PISTACHIO BALL (10809),1351214106412,FINI- ASSORTED,160.00,106412.jpg
111969,PREMIUM BELGIUM LOLLIPOP WHITE HEART PCS,1351214111969,FINI- ASSORTED,4.76,111969.jpg
111970,PREMIUM BELGIUM OPEN BROWN BIG FLOWER PCS,1351214111970,FINI- ASSORTED,130.00,111970.jpg
111980,PREMIUM BELGIUM OPEN WHITE BIG FLOWER PCS,1351214111980,FINI- ASSORTED,130.00,111980.jpg
112351,FEUILLETINE CORNFLAKES DARK CHOCO KG,1351214112351,FINI- ASSORTED,123.81,112351.png
112352,FEUILLETINE CORNFLAKES CARAMEL KG,1351214112352,FINI- ASSORTED,123.81,112352.jpg
112415,PREMIUM BELGIUM BIG EGG WHITE PISTACHIO COTTON CANDY WITH CREAM PC,1351214112415,FINI- ASSORTED,6.00,112415.jpg
112536,WRAPPED BROWN FRUITY CHOCOLATE KG,1351214112536,FINI- ASSORTED,160.00,112536.jpg
112615,WRAPPED FRUITY WHITE CHOCOLATE KG,1351214112615,FINI- ASSORTED,160.00,112615.jpg
112864,FEUILLETINE CORNFLAKES CHOCOLATE KG,1351214112864,FINI- ASSORTED,123.81,112864.jpg
113310,CRAFTED CHOCOLATES WITH WHITE CHOCOLATE KG,1351214113310,FINI- ASSORTED,200.00,113310.jpg
113352,PREMIUM BELGIUM LOLLIPOP RED HEART WITH PLAIN CHOCOLATE PCS,1351214113352,FINI- ASSORTED,4.76,113352.jpg
113353,PREMIUM BELGIUM BIG EGG BLUE PISTACHIO COTTON CANDY WITH CREAM PC,1351214113353,FINI- ASSORTED,6.00,113353.jpg
113354,PREMIUM BELGIUM BIG EGG PINK PISTACHIO COTTON CANDY WITH CREAM PC,1351214113354,FINI- ASSORTED,6.00,113354.jpg
113370,PREMIUM BELGIUM WRAPPED BIG EGG WHITE PISTACHIO COTTON CANDY WITH CREAM PC,1351214113370,FINI- ASSORTED,6.00,113370.jpg
113518,ARABIC COFFEE 900G PKT (112852),1351214113518,FINI- ASSORTED,59.05,113518.jpg
113519,ARABIC COFFEE 450G PKT (112853),1351214113519,FINI- ASSORTED,37.14,113519.jpg
113533,PREMIUM BELGIUM WRAPPED BIG EGG RED COTTON CANDY PC,1351214113533,FINI- ASSORTED,6.00,113533.jpg
113534,PREMIUM BELGIUM BIG EGG RED COTTON CANDY PC,1351214113534,FINI- ASSORTED,6.00,113534.jpg
108689,PREMIUM BELGIUM WRAPPED BROWN CHOCOLATE SPOON PC,1351214108689,FINI- ASSORTED,3.19,108689.jpg
111963,PREMIUM BELGIUM WRAPPED WHITE CHOCOLATE SPOON PC,1351214111963,FINI- ASSORTED,3.19,111963.jpg
112393,PREMIUM BELGIUM OPEN BROWN CHOCOLATE SPOON PC,1351214112393,FINI- ASSORTED,3.19,112393.jpg
112394,PREMIUM BELGIUM OPEN WHITE CHOCOLATE SPOON PC,1351214112394,FINI- ASSORTED,3.19,112394.jpg
112422,PREMIUM BAKLAWA NEST ASH BULBUL CASHEW KG,1351214112422,FINI- BAKLAWA,160.00,112422.jpg
112423,PREMIUM BAKLAWA NEST ASH BULBUL PISTACHIO  KG,1351214112423,FINI- BAKLAWA,160.00,112423.jpg
112424,PREMIUM BAKLAWA RECT ASIAN WALNUT KG,1351214112424,FINI- BAKLAWA,160.00,112424.jpg
112425,PREMIUM BAKLAWA RECT AYYA CASHEW KG,1351214112425,FINI- BAKLAWA,160.00,112425.jpg
112426,PREMIUM BAKLAWA RECT AYYA PISTACHIO KG,1351214112426,FINI- BAKLAWA,160.00,112426.jpg
112427,PREMIUM BAKLAWA SQUARE TURKISH WALNUT KG,1351214112427,FINI- BAKLAWA,160.00,112427.jpg
112428,PREMIUM BAKLAWA DIAMOND TURKISH PISTACHIO KG,1351214112428,FINI- BAKLAWA,160.00,112428.jpg
112429,PREMIUM BAKLAWA SQUARE TURKISH PISTACHIO KG,1351214112429,FINI- BAKLAWA,160.00,112429.jpg
112430,PREMIUM BAKLAWA FINGER DOLMA KG,1351214112430,FINI- BAKLAWA,160.00,112430.jpg
112431,PREMIUM BAKLAWA FINGER CASHEW SMALL KG,1351214112431,FINI- BAKLAWA,160.00,112431.jpg
112432,PREMIUM BAKLAWA FINGER CASHEW KG,1351214112432,FINI- BAKLAWA,160.00,112432.jpg
112433,PREMIUM BAKLAWA FINGER LOS KG,1351214112433,FINI- BAKLAWA,160.00,112433.jpg
112434,PREMIUM BAKLAWA ROUND FLOWER WALNUT KG,1351214112434,FINI- BAKLAWA,160.00,112434.jpg
112435,PREMIUM BAKLAWA ROUND MABROOM PISTACHIO KG,1351214112435,FINI- BAKLAWA,160.00,112435.jpg
112436,PREMIUM BAKLAWA EYE MEDYA CHOCOLATE KG,1351214112436,FINI- BAKLAWA,160.00,112436.jpg
112437,PREMIUM BAKLAWA EYE MEDYA PISTACHIO KG,1351214112437,FINI- BAKLAWA,160.00,112437.jpg
112438,PREMIUM BAKLAWA SQUARE MORBHA CASHEW KG,1351214112438,FINI- BAKLAWA,160.00,112438.jpg
112439,PREMIUM BAKLAWA PECAN WALNUT KG,1351214112439,FINI- BAKLAWA,160.00,112439.jpg
112567,PREMIUM BAKLAWA WRAPPED NEST ASH BULBUL MIX NUTS KG,1351214112567,FINI- BAKLAWA,160.00,112567.jpg
112569,PREMIUM BAKLAWA WRAPPED NOUGAT CREAM PISTACHIO KG,1351214112569,FINI- BAKLAWA,160.00,112569.jpg
112571,PREMIUM BAKLAWA WRAPPED NOUGAT SQUARE MIX NUTS KG,1351214112571,FINI- BAKLAWA,160.00,112571.jpg
113361,PREMIUM BAKLAWA WRAPPED EYE MEDYA PISTACHIO KG,1351214113361,FINI- BAKLAWA,160.00,113361.jpg
113363,PREMIUM BAKLAWA WRAPPED NEST ASH BULBUL CASHEW KG,1351214113363,FINI- BAKLAWA,160.00,113363.jpg
113364,PREMIUM BAKLAWA WRAPPED NEST ASH BULBUL PISTACHIO  KG,1351214113364,FINI- BAKLAWA,160.00,113364.jpg
113365,PREMIUM BAKLAWA WRAPPED RECT ASIAN WALNUT KG,1351214113365,FINI- BAKLAWA,160.00,113365.jpg
113366,PREMIUM BAKLAWA WRAPPED RECT AYYA CASHEW KG,1351214113366,FINI- BAKLAWA,160.00,113366.jpg
113367,PREMIUM BAKLAWA BAKLAWA RECT AYYA PISTACHIO KG,1351214113367,FINI- BAKLAWA,160.00,113367.jpg
113368,PREMIUM BAKLAWA WRAPPED SQUARE TURKISH WALNUT KG,1351214113368,FINI- BAKLAWA,160.00,113368.jpg
113369,PREMIUM BAKLAWA WRAPPED DIAMOND TURKISH PISTACHIO KG,1351214113369,FINI- BAKLAWA,160.00,113369.jpg
113376,PREMIUM BAKLAWA WRAPPED SQUARE TURKISH PISTACHIO KG,1351214113376,FINI- BAKLAWA,160.00,113376.jpg
113377,PREMIUM BAKLAWA WRAPPED FINGER DOLMA KG,1351214113377,FINI- BAKLAWA,160.00,113377.jpg
113378,PREMIUM BAKLAWA WRAPPED FINGER CASHEW SMALL KG,1351214113378,FINI- BAKLAWA,160.00,113378.jpg
113379,PREMIUM BAKLAWA WRAPPED FINGER CASHEW KG,1351214113379,FINI- BAKLAWA,160.00,113379.jpg
113380,PREMIUM BAKLAWA WRAPPED FINGER LOS KG,1351214113380,FINI- BAKLAWA,160.00,113380.jpg
113381,PREMIUM BAKLAWA WRAPPED ROUND FLOWER WALNUT KG,1351214113381,FINI- BAKLAWA,160.00,113381.jpg
113382,PREMIUM BAKLAWA WRAPPED ROUND MABROOM PISTACHIO KG,1351214113382,FINI- BAKLAWA,160.00,113382.jpg
113383,PREMIUM BAKLAWA WRAPPED EYE MEDYA CHOCOLATE KG,1351214113383,FINI- BAKLAWA,160.00,113383.jpg
113384,PREMIUM BAKLAWA WRAPPED SQUARE MORBHA CASHEW KG,1351214113384,FINI- BAKLAWA,160.00,113384.jpg
113385,PREMIUM BAKLAWA WRAPPED PECAN WALNUT KG,1351214113385,FINI- BAKLAWA,160.00,113385.jpg
114073,PREMIUM BAKLAWA WRAPPED FAISALIYAH PISTACHIO KG,1351214114073,FINI- BAKLAWA,160.00,114073.jpg
113279,CAKE TOPPER BROWN ROUND 12X12,1351214113279,FINI- CAKE TOPPER,10.00,113279.jpg
113280,CAKE TOPPER BROWN ROUND 13X13,1351214113280,FINI- CAKE TOPPER,10.00,113280.jpg
113281,CAKE TOPPER BROWN ROUND 14X14,1351214113281,FINI- CAKE TOPPER,10.00,113281.jpg
113282,CAKE TOPPER BROWN ROUND 15X15,1351214113282,FINI- CAKE TOPPER,10.00,113282.jpg
113283,CAKE TOPPER BROWN RECTANGLE 2X6,1351214113283,FINI- CAKE TOPPER,10.00,113283.jpg
113284,CAKE TOPPER BROWN RECTANGLE 3X7,1351214113284,FINI- CAKE TOPPER,10.00,113284.jpg
113285,CAKE TOPPER BROWN ROUND 3X3,1351214113285,FINI- CAKE TOPPER,10.00,113285.jpg
113286,CAKE TOPPER BROWN ROUND 4X4,1351214113286,FINI- CAKE TOPPER,10.00,113286.jpg
113287,CAKE TOPPER BROWN ROUND 5X5,1351214113287,FINI- CAKE TOPPER,10.00,113287.jpg
113288,CAKE TOPPER BROWN ROUND 7X7,1351214113288,FINI- CAKE TOPPER,10.00,113288.jpg
113289,CAKE TOPPER BROWN ROUND 8X8,1351214113289,FINI- CAKE TOPPER,10.00,113289.jpg
113290,CAKE TOPPER BROWN ROUND 10X10,1351214113290,FINI- CAKE TOPPER,10.00,113290.jpg
111212,PREMIUM COOKIES RED VELVET KG,1351214111212,FINI- COOKIES,140.00,111212.jpg
111213,PREMIUM COOKIES COCONUT KG,1351214111213,FINI- COOKIES,140.00,111213.jpg
111214,PREMIUM COOKIES NUTELLA KG,1351214111214,FINI- COOKIES,140.00,111214.jpg
111215,PREMIUM COOKIES PISTACHIO KG,1351214111215,FINI- COOKIES,140.00,111215.jpeg
111216,PREMIUM COOKIES KUNAFA PISTACHIO KG,1351214111216,FINI- COOKIES,140.00,111216.jpg
111217,PREMIUM COOKIES NUTELLA CHOCOLATE KG,1351214111217,FINI- COOKIES,140.00,111217.jpg
111218,PREMIUM COOKIES WALNUT KG,1351214111218,FINI- COOKIES,140.00,111218.jpg
112578,PREMIUM BELGIUM EGG OPEN WHITE AND GREEN PISTACHIO KG,1351214112578,FINI- EGGS OPEN,140.00,112578.jpg
112632,PREMIUM BELGIUM EGG OPEN WHITE AND PINK COTTON CANDY PISTACHIO NUTS AND CREAM,1351214112632,FINI- EGGS OPEN,130.00,112632.jpg
111121,PREMIUM BELGIUM EGG OPEN GREEN PISTACHIO KUNAFA KG,1351214111121,FINI- EGGS OPEN,140.00,111121.jpg
111123,PREMIUM BELGIUM OPEN EGG WHITE CARAMEL & HAZELNUT KG,1351214111123,FINI- EGGS OPEN,130.00,111123.jpg
111131,PREMIUM BELGIUM EGG OPEN GOLD FEUILLETINE & NUTELLA KG,1351214111131,FINI- EGGS OPEN,130.00,111131.png
111132,PREMIUM BELGIUM EGG OPEN WHITE WITH WAFER & HAZELNUT KG,1351214111132,FINI- EGGS OPEN,130.00,111132.png
111133,PREMIUM BELGIUM EGG OPEN WHITE WITH GAZEL CANDY & PISTACHIO KG,1351214111133,FINI- EGGS OPEN,130.00,111133.jpg
111134,PREMIUM BELGIUM EGG OPEN BROWN WITH WAFER HAZELNUT KG,1351214111134,FINI- EGGS OPEN,130.00,111134.png
111259,PREMIUM BELGIUM EGG OPEN WHITE KG,1351214111259,FINI- EGGS OPEN,130.00,111259.jpg
111964,PREMIUM BELGIUM EGG OPEN BROWN WAFER MINI KG,1351214111964,FINI- EGGS OPEN,130.00,111964.jpg
111965,PREMIUM BELGIUM EGG OPEN GOLD CORNFLAKES KG,1351214111965,FINI- EGGS OPEN,130.00,111965.jpg
111966,PREMIUM BELGIUM EGG OPEN GREEN PISTACHIO KG,1351214111966,FINI- EGGS OPEN,140.00,111966.jpg
111967,PREMIUM BELGIUM EGG OPEN PINK WAFER KG,1351214111967,FINI- EGGS OPEN,130.00,111967.jpg
111968,PREMIUM BELGIUM EGG OPEN WHITE WAFER KG,1351214111968,FINI- EGGS OPEN,130.00,111968.jpg
112039,PREMIUM BELGIUM EGG OPEN GREEN WAFER KG,1351214112039,FINI- EGGS OPEN,130.00,112039.jpg
112277,PREMIUM BELGIUM EGG OPEN RED WAFER KG,1351214112277,FINI- EGGS OPEN,130.00,112277.jpg
112355,PREMIUM BELGIUM EGG OPEN BROWN PURE WAFER KG,1351214112355,FINI- EGGS OPEN,130.00,112355.jpg
112417,PREMIUM BELGIUM EGG OPEN BROWN WHITE MAROON PISTACHIO KG,1351214112417,FINI- EGGS OPEN,140.00,112417.jpg
112419,PREMIUM BELGIUM EGG OPEN GREEN COTTON CANDY PISTACHIO NUTS AND CREAM,1351214112419,FINI- EGGS OPEN,130.00,112419.jpg
112481,PREMIUM BELGIUM EGG OPEN BROWN PURE PISTACHIO KUNAFA KG,1351214112481,FINI- EGGS OPEN,140.00,112481.jpg
112572,PREMIUM BELGIUM EGG OPEN SILVER AND BLACK CARAMEL WITH HAZELNUT NUTS AND CREAM NEW HAZELNUT KG,1351214112572,FINI- EGGS OPEN,130.00,112572.jpg
112573,PREMIUM BELGIUM EGG OPEN BROWN AND GOLD WITH MILK CARAMEL WITH HAZELNUT NUTS AND CREAM NEW HAZELNUT KG,1351214112573,FINI- EGGS OPEN,130.00,112573.jpg
112580,PREMIUM BELGIUM EGG OPEN BROWN AND GOLD CORNFLAKES KG,1351214112580,FINI- EGGS OPEN,130.00,112580.jpg
112618,PREMIUM BELGIUM EGG OPEN RED WITH WAFER & HAZELNUT KG,1351214112618,FINI- EGGS OPEN,130.00,112618.jpg
112620,PREMIUM BELGIUM EGG OPEN GOLD WITH WAFER & HAZELNUT KG,1351214112620,FINI- EGGS OPEN,130.00,112620.png
112682,PREMIUM BELGIUM EGG OPEN BROWN WITH PINK DOTS PURE PISTACHIO KUNAFA KG,1351214112682,FINI- EGGS OPEN,140.00,112682.jpg
112702,PREMIUM BELGIUM EGG OPEN GOLD WAFER KG,1351214112702,FINI- EGGS OPEN,130.00,112702.png
113204,PREMIUM BELGIUM EGG OPEN BLUE STRAWBERRY CHEESECAKE WITH LOTUS POWDER KG,1351214113204,FINI- EGGS OPEN,140.00,113204.jpg
113412,PREMIUM BELGIUM EGG OPEN WHITE PISTACHIO KG,1351214113412,FINI- EGGS OPEN,140.00,113412.jpg
113430,PREMIUM BELGIUM EGG OPEN WHITE CORNFLAKES KG,1351214113430,FINI- EGGS OPEN,130.00,113430.jpg
111465,PREMIUM BELGIUM EGG WRAPPED BROWN CARAMEL CARAMEL & HAZELNUT KG,1351214111465,FINI- EGGS WRAPPED,140.00,111465.jpg
112768,GLASS ICE CREAM ALMOND,1351214112768,FINI- ICE CREAM GLASS,5.00,112768.jpg
112769,GLASS ICE CREAM CHOCOLATE,1351214112769,FINI- ICE CREAM GLASS,5.00,112769.jpg
112770,GLASS ICE CREAM CHOCOLATE VANILLA,1351214112770,FINI- ICE CREAM GLASS,5.00,112770.jpg
112771,GLASS ICE CREAM HAZELNUT,1351214112771,FINI- ICE CREAM GLASS,5.00,112771.jpg
112772,GLASS ICE CREAM KUNAFA,1351214112772,FINI- ICE CREAM GLASS,5.00,112772.jpg
112773,GLASS ICE CREAM LEMON,1351214112773,FINI- ICE CREAM GLASS,5.00,112773.jpg
112774,GLASS ICE CREAM LO-BISCUIT,1351214112774,FINI- ICE CREAM GLASS,5.00,112774.jpg
112775,GLASS ICE CREAM MANGO,1351214112775,FINI- ICE CREAM GLASS,5.00,112775.jpg
112776,GLASS ICE CREAM MUSTIKA,1351214112776,FINI- ICE CREAM GLASS,5.00,112776.jpg
112777,GLASS ICE CREAM PISTACHIO,1351214112777,FINI- ICE CREAM GLASS,5.00,112777.jpg
112778,GLASS ICE CREAM RASPBERRY,1351214112778,FINI- ICE CREAM GLASS,5.00,112778.jpg
112779,GLASS ICE CREAM ROSE PISTACHIO,1351214112779,FINI- ICE CREAM GLASS,5.00,112779.jpg
112780,GLASS ICE CREAM CARAMEL & PEANUTS,1351214112780,FINI- ICE CREAM GLASS,5.00,112780.jpg
112781,GLASS ICE CREAM STRAWBERRY,1351214112781,FINI- ICE CREAM GLASS,5.00,112781.jpg
112745,ICE CREAM SCOOP BAKLAWA,1351214112745,FINI- ICE CREAM SCOOP,7.00,112745.jpg
112746,ICE CREAM SCOOP BANANA,1351214112746,FINI- ICE CREAM SCOOP,7.00,112746.jpg
112747,ICE CREAM SCOOP BLUEBERRY,1351214112747,FINI- ICE CREAM SCOOP,7.00,112747.jpg
112748,ICE CREAM SCOOP CARAMEL,1351214112748,FINI- ICE CREAM SCOOP,7.00,112748.jpg
112749,ICE CREAM SCOOP CHEESECAKE,1351214112749,FINI- ICE CREAM SCOOP,7.00,112749.jpg
112750,ICE CREAM SCOOP CHOCO HAZELNUT,1351214112750,FINI- ICE CREAM SCOOP,7.00,112750.jpg
112751,ICE CREAM SCOOP CHOCOLATE CAKE,1351214112751,FINI- ICE CREAM SCOOP,7.00,112751.jpg
112752,ICE CREAM SCOOP FIGS,1351214112752,FINI- ICE CREAM SCOOP,7.00,112752.jpg
112753,ICE CREAM SCOOP HAZELNUT,1351214112753,FINI- ICE CREAM SCOOP,7.00,112753.jpg
112754,ICE CREAM SCOOP KUNAFA,1351214112754,FINI- ICE CREAM SCOOP,7.00,112754.jpg
112755,ICE CREAM SCOOP LEMON,1351214112755,FINI- ICE CREAM SCOOP,7.00,112755.jpg
112756,ICE CREAM SCOOP LO-BISCUIT,1351214112756,FINI- ICE CREAM SCOOP,7.00,112756.jpg
112757,ICE CREAM SCOOP MANGO,1351214112757,FINI- ICE CREAM SCOOP,7.00,112757.jpg
112758,ICE CREAM SCOOP MARSHMALLOW,1351214112758,FINI- ICE CREAM SCOOP,7.00,112758.jpg
112759,ICE CREAM SCOOP MILK&CHOCO,1351214112759,FINI- ICE CREAM SCOOP,7.00,112759.jpg
112761,ICE CREAM SCOOP MUSTICA,1351214112761,FINI- ICE CREAM SCOOP,7.00,112761.jpg
112762,ICE CREAM SCOOP OR-BISCUIT,1351214112762,FINI- ICE CREAM SCOOP,7.00,112762.jpg
112763,ICE CREAM SCOOP PISTACHIO,1351214112763,FINI- ICE CREAM SCOOP,7.00,112763.jpg
112764,ICE CREAM SCOOP RED VELVET,1351214112764,FINI- ICE CREAM SCOOP,7.00,112764.jpg
112765,ICE CREAM SCOOP CARAMEL & PEANUTS,1351214112765,FINI- ICE CREAM SCOOP,7.00,112765.jpg
112766,ICE CREAM SCOOP STRAWBERRY,1351214112766,FINI- ICE CREAM SCOOP,7.00,112766.jpg
112767,ICE CREAM SCOOP VANILLA,1351214112767,FINI- ICE CREAM SCOOP,7.00,112767.jpg
111105,PREMIUM CHOCOLATE MACARON BROWN HAZELNUT MACARON & HAZELNUT KG,1351214111105,FINI- MACARON,135.00,111105.jpg
111106,PREMIUM CHOCOLATE MACARON BROWN PISTACHIO MACARON & PISTACHIO KG,1351214111106,FINI- MACARON,135.00,111106.jpg
111107,PREMIUM CHOCOLATE MACARON BROWN CHEESECAKE MACARON & CHEESECAKE KG,1351214111107,FINI- MACARON,135.00,111107.jpg
111108,PREMIUM CHOCOLATE MACARON BROWN SNICKERS MACARON & SNICKERS KG,1351214111108,FINI- MACARON,135.00,111108.jpg
111109,PREMIUM CHOCOLATE MACARON BROWN LOTUS MACARON & LOTUS KG,1351214111109,FINI- MACARON,135.00,111109.jpg
111344,PREMIUM CHOCOLATE MACARON WHITE HAZELNUT MACARON & HAZELNUT KG,1351214111344,FINI- MACARON,130.00,111344.jpg
111385,PREMIUM CHOCOLATE MACARON BROWN SNICKERS MACARON & SNICKERS KG,1351214111385,FINI- MACARON,130.00,111385.jpg
112360,PREMIUM CHOCOLATE MACARON BLUE CHEESECAKE MACARON & CHEESECAKE KG,1351214112360,FINI- MACARON,130.00,112360.jpg
112361,PREMIUM CHOCOLATE MACARON BLUE LOTUS MACARON & LOTUS KG,1351214112361,FINI- MACARON,130.00,112361.jpg
112720,PREMIUM CHOCOLATE MACARON WHITE ALMOND & NEW HAZELNUT MACARON KG,1351214112720,FINI- MACARON,130.00,112720.jpg
112723,PREMIUM CHOCOLATE MACARON BROWN HAZELNUT WITH DARK JANDOYA  MACARON KG,1351214112723,FINI- MACARON,130.00,112723.jpg
113308,PREMIUM CHOCOLATE MACARON RED CARAMEL WITH SESAME MACARON KG,1351214113308,FINI- MACARON,130.00,113308.jpg
113309,PREMIUM CHOCOLATE MACARON BROWN CARAMEL WITH ALMOND WHITE NOUGAT MACARON KG,1351214113309,FINI- MACARON,130.00,113309.jpg
108555,PREMIUM MAAMOUL DATES BROWN KG,1351214108555,FINI- MAMOUL,66.67,108555.jpg
111206,PREMIUM MAAMOUL DATES KG,1351214111206,FINI- MAMOUL,66.67,111206.png
111207,PREMIUM MAAMOUL FIGS KG,1351214111207,FINI- MAMOUL,66.67,111207.png
111208,PREMIUM MAAMOUL FIGS BROWN KG,1351214111208,FINI- MAMOUL,66.67,111208.png
111209,PREMIUM MAAMOUL WALNUT KG,1351214111209,FINI- MAMOUL,66.67,111209.png
111210,PREMIUM MAAMOUL DATES & WALNUT KG,1351214111210,FINI- MAMOUL,66.67,111210.png
111211,PREMIUM MAAMOUL PISTACHIO KG,1351214111211,FINI- MAMOUL,80.95,111211.png
112407,PREMIUM MAAMOUL WHOLE MEAL PECAN DATES SQUARE KG,1351214112407,FINI- MAMOUL,140.00,112407.jpg
100937,PREMIUM WRAPPED FIGS PLAIN- KG,1351214002153,FINI- NUTS,140.00,100937.jpg
111221,PREMIUM APRICOAT WITH ALMOND KG,1351214111221,FINI- NUTS,140.00,111221.jpg
111246,PREMIUM MAJDOOLS JUMBO WITH WALNUT KG,1351214111246,FINI- NUTS,140.00,111246.jpg
111252,PREMIUM APRICOAT WITH CASHEW KG,1351214111252,FINI- NUTS,140.00,111252.jpg
111253,PREMIUM APRICOAT WITH HAZELNUT KG,1351214111253,FINI- NUTS,140.00,111253.jpg
111255,PREMIUM APRICOAT WITH WALNUT KG,1351214111255,FINI- NUTS,140.00,111255.jpg
111260,PREMIUM DATES WITH CASHEW KG,1351214111260,FINI- NUTS,140.00,111260.jpg
111261,PREMIUM DATES WITH HAZELNUT KG,1351214111261,FINI- NUTS,140.00,111261.jpg
111262,PREMIUM DATES WITH PISTACHIO KG,1351214111262,FINI- NUTS,140.00,111262.jpg
111263,PREMIUM DATES WITH WALNUT KG,1351214111263,FINI- NUTS,140.00,111263.jpg
111264,PREMIUM DATES WITH WHITE WALNUT KG,1351214111264,FINI- NUTS,140.00,111264.jpg
111266,PREMIUM FIGS ROUND WALNUT KG,1351214111266,FINI- NUTS,140.00,111266.png
111267,PREMIUM FIGS WITH ALMOND KG,1351214111267,FINI- NUTS,140.00,111267.jpg
111268,PREMIUM FIGS WITH CASHEW KG,1351214111268,FINI- NUTS,140.00,111268.jpg
111270,PREMIUM FIGS WITH HAZELNUT KG,1351214111270,FINI- NUTS,140.00,111270.jpg
111271,PREMIUM FIGS WITH PISTACHIO KG,1351214111271,FINI- NUTS,140.00,111271.jpg
111272,PREMIUM FIGS WITH WALNUT KG,1351214111272,FINI- NUTS,140.00,111272.jpg
111273,PREMIUM MAJDOOLS JUMBO WITH ALMOND KG,1351214111273,FINI- NUTS,140.00,111273.jpg
111274,PREMIUM MAJDOOLS JUMBO WITH CASHEW KG,1351214111274,FINI- NUTS,140.00,111274.jpg
111276,PREMIUM DATES WITH RASPBERRY KG,1351214111276,FINI- NUTS,140.00,111276.jpg
111277,PREMIUM DATES WITH ALMOND KG,1351214111277,FINI- NUTS,140.00,111277.jpg
112358,PREMIUM MAJDOOLS JUMBO WITH PISTACHIO KG,1351214112358,FINI- NUTS,140.00,112358.jpg
112710,PREMIUM DATES WRAPPED WITH WALNUT KG,1351214112710,FINI- NUTS,140.00,112710.jpg
112711,PREMIUM DATES WRAPPED WITH HAZELNUT KG,1351214112711,FINI- NUTS,140.00,112711.jpg
112712,PREMIUM FIGS WRAPPED WITH PISTACHIO KG,1351214112712,FINI- NUTS,140.00,112712.jpg
