Item Code,Item Description,Barcode,Category,Price,Image Filename
111279,PREMIUM BELGIUM OPEN WHITE SQUARE WITH LOTUS KG,1351214111279,BELGIUM - OPEN,130.00,111279.png
111280,PREMIUM BELGIUM OPEN WHITE HAZELNUT CARAMEL KG,1351214111280,BELGIUM - OPEN,130.00,111311.jpg
111281,PREMIUM BELGIUM OPEN WHITE HEART PRALINE HAZELNUT CARAMEL KG,1351214111281,BELGIUM - OPEN,130.00,111281.jpg
111283,PREMIUM BELGIUM OPEN WHITE REGAL SQUARE PISTACHIO & MASTIC KG,1351214111283,BELGIUM - OPEN,130.00,111086.jpg
111284,"PREMIUM BELGIUM OPEN WHITE PARIS HAZELNUT PRALINE & HONEY, CARAMEL & HAZELNUTS & COFFEE KG",1351214111284,BELGIUM - OPEN,130.00,111089.jpg
111285,PREMIUM BELGIUM OPEN WHITE CHOCO MAP SAFFRON & PISTACHIO KG,1351214111285,BELGIUM - OPEN,130.00,111090.png
111286,PREMIUM BELGIUM OPEN WHITE TRIO HARMONY A HAZELNUT & CARAMEL KG,1351214111286,BELGIUM - OPEN,130.00,111286.jpg
111287,PREMIUM BELGIUM OPEN WHITE CHOCO TEAR GIANDUJA & CARAMEL & FEUILLETINE  & NUTS & HAZELNUTS KG,1351214111287,BELGIUM - OPEN,130.00,111092.jpg
111288,PREMIUM BELGIUM OPEN WHITE CHOCO SQUIRREL CHEESECAKE & STRAWBERRIES  & BISCUIT KG,1351214111288,BELGIUM - OPEN,130.00,111288.jpg
111289,PREMIUM BELGIUM OPEN BROWN CHOCO SQUIRREL CHEESECAKE & STRAWBERRIES  & BISCUIT KG,1351214111289,BELGIUM - OPEN,130.00,111289.jpg
111290,PREMIUM BELGIUM OPEN WHITE CHOCO SQUIRREL HAZELNUT NOUGAT & ALMONDS & CARAMEL KG,1351214111290,BELGIUM - OPEN,130.00,111290.jpg
111291,PREMIUM BELGIUM OPEN WHITE CHOCO BALL HAZELNUT PASTE KG,1351214111291,BELGIUM - OPEN,130.00,111099.jpg
111292,PREMIUM BELGIUM OPEN WHITE CHOCO DOME CHEESECAKE & STRAWBERRIES KG,1351214111292,BELGIUM - OPEN,130.00,111110.jpg
111293,PREMIUM BELGIUM OPEN WHITE ANDALUSIA GIANDUJA & CARAMEL & CRISPY KG,1351214111293,BELGIUM - OPEN,130.00,111293.jpg
111294,PREMIUM BELGIUM OPEN WHITE CHOCO BRICK PRALINE SESAME & CARAMEL KG,1351214111294,BELGIUM - OPEN,130.00,111294.jpg
111295,PREMIUM BELGIUM OPEN WHITE HEART HAZELNUT GIANDUJA & ALMOND NUTS KG,1351214111295,BELGIUM - OPEN,130.00,111295.jpg
111296,PREMIUM BELGIUM OPEN WHITE SNOW HOUSE CHOCOLATE & NUTS & PISTACHIO KG,1351214111296,BELGIUM - OPEN,130.00,111296.jpg
111297,PREMIUM BELGIUM OPEN BROWN CORNFLAKES KG,1351214111297,BELGIUM - OPEN,130.00,111473.jpg
111298,PREMIUM BELGIUM OPEN BROWN REGAL SQUARE PISTACHIO & MASTIC KG,1351214111298,BELGIUM - OPEN,130.00,111298.jpg
111299,"PREMIUM BELGIUM OPEN BROWN PARIS HAZELNUT PRALINE & HONEY, CARAMEL & HAZELNUTS & COFFEE KG",1351214111299,BELGIUM - OPEN,130.00,111299.jpg
111300,PREMIUM BELGIUM OPEN BROWN CHOCO MAP SAFFRON & PISTACHIO KG,1351214111300,BELGIUM - OPEN,130.00,111300.jpg
111301,PREMIUM BELGIUM OPEN BROWN TRIO HARMONY A HAZELNUT & CARAMEL KG,1351214111301,BELGIUM - OPEN,130.00,111301.jpg
111302,PREMIUM BELGIUM OPEN BROWN CHOCO TEAR GIANDUJA & CARAMEL & FEUILLETINE  & NUTS & HAZELNUTS KG,1351214111302,BELGIUM - OPEN,130.00,111302.jpg
111303,PREMIUM BELGIUM OPEN BROWN GOLDEN LINE HAZELNUT GIANDUJA & CARAMEL KG,1351214111303,BELGIUM - OPEN,130.00,111098.png
111304,PREMIUM BELGIUM OPEN BROWN CHOCO BALL HAZELNUT PASTE KG,1351214111304,BELGIUM - OPEN,130.00,111304.jpg
111305,PREMIUM BELGIUM OPEN BROWN ANDALUSIA GIANDUJA & CARAMEL & CRISPY KG,1351214111305,BELGIUM - OPEN,130.00,111305.jpg
111306,PREMIUM BELGIUM OPEN BROWN CHOCO BRICK PRALINE SESAME & CARAMEL KG,1351214111306,BELGIUM - OPEN,130.00,111114.png
111307,PREMIUM BELGIUM OPEN BROWN CHOCO SQUIRREL COFFEE FILLING & CREAM KG,1351214111307,BELGIUM - OPEN,130.00,111307.jpg
111308,PREMIUM BELGIUM OPEN BROWN HEART HAZELNUT GIANDUJA & ALMOND NUTS KG,1351214111308,BELGIUM - OPEN,130.00,111308.jpg
111310,PREMIUM BELGIUM OPEN BROWN HEART PRALINE HAZELNUT CARAMEL KG,1351214111310,BELGIUM - OPEN,130.00,111310.jpg
111311,PREMIUM BELGIUM OPEN BROWN HAZELNUT CARAMEL KG,1351214111311,BELGIUM - OPEN,130.00,111311.jpg
111320,PREMIUM BELGIUM OPEN WHITE BLISS SQUARE GIANDUJA & CARAMEL & HAZELNUTS KG,1351214111320,BELGIUM - OPEN,130.00,111088.jpg
111321,PREMIUM BELGIUM OPEN WHITE CHOCO ALMOND SQUARE ALMOND KG,1351214111321,BELGIUM - OPEN,130.00,111321.png
111322,PREMIUM BELGIUM OPEN WHITE CHOCO CRISPY SQUARE CRISPY KG,1351214111322,BELGIUM - OPEN,130.00,111140.jpg
111323,PREMIUM BELGIUM OPEN WHITE CHOCO HAZELNUT SQUARE  HAZELNUT KG,1351214111323,BELGIUM - OPEN,130.00,111323.png
111324,PREMIUM BELGIUM OPEN WHITE PISTACHIO KUNAFA KG,1351214111324,BELGIUM - OPEN,180.00,110944.jpg
111325,PREMIUM BELGIUM OPEN WHITE CHOCO MATRESS GIANDUJA & NUTS & FEUILLETINE KG,1351214111325,BELGIUM - OPEN,130.00,111096.jpg
111326,PREMIUM BELGIUM OPEN WHITE CHOCO PISTACHIO SQUARE PISTACHIO KG,1351214111326,BELGIUM - OPEN,130.00,111138.jpg
111327,PREMIUM BELGIUM OPEN WHITE CHOCO PLAIN SQUARE PLAIN KG,1351214111327,BELGIUM - OPEN,130.00,111136.jpg
111328,PREMIUM BELGIUM OPEN WHITE CHOCO RING OREO BISCUIT FILLING KG,1351214111328,BELGIUM - OPEN,130.00,111116.jpg
111329,PREMIUM BELGIUM OPEN WHITE CHOCO RIPPLE CUP CARAMEL & CREAM KG,1351214111329,BELGIUM - OPEN,130.00,111093.png
111330,PREMIUM BELGIUM OPEN WHITE CHOCO SQUIRREL COFFEE FILLING & CREAM KG,1351214111330,BELGIUM - OPEN,130.00,111330.jpg
111331,PREMIUM BELGIUM OPEN WHITE CHOCO SQUIRREL PLAIN & BELGIAN KG,1351214111331,BELGIUM - OPEN,130.00,111130.jpg
111332,PREMIUM BELGIUM OPEN WHITE CHOCO SWIRL TRUFFLE & PISTACHIO NUTS KG,1351214111332,BELGIUM - OPEN,130.00,111332.jpg
111333,PREMIUM BELGIUM OPEN WHITE CHOCO WAFER SQUARE WAFER KG,1351214111333,BELGIUM - OPEN,130.00,111137.jpg
111335,PREMIUM BELGIUM OPEN WHITE DALLAH COFFEE KG,1351214111335,BELGIUM - OPEN,130.00,111104.jpg
111336,PREMIUM BELGIUM OPEN WHITE DIRHAM NUTELLA & HAZELNUTS KG,1351214111336,BELGIUM - OPEN,130.00,111095.jpg
111337,PREMIUM BELGIUM OPEN WHITE GOLDEN LINE HAZELNUT GIANDUJA & CARAMEL KG,1351214111337,BELGIUM - OPEN,130.00,111337.jpg
111338,PREMIUM BELGIUM OPEN WHITE GOLDEN LINE PEANUT & CARAMEL KG,1351214111338,BELGIUM - OPEN,130.00,111338.jpg
111339,PREMIUM BELGIUM OPEN WHITE HAZEL CROWN NUTELLA & HAZELNUTS KG,1351214111339,BELGIUM - OPEN,130.00,111103.jpg
111340,PREMIUM BELGIUM OPEN WHITE HAZELNUT PRALINE & TRUFFLE & WHOLE HAZELNUT KG,1351214111340,BELGIUM - OPEN,130.00,111340.jpg
111341,PREMIUM BELGIUM OPEN WHITE TEAR HAZELNUT KG,1351214111341,BELGIUM - OPEN,130.00,111127.png
111342,PREMIUM BELGIUM OPEN WHITE LULU CUP CUP OF KIBANDER & LULU PIECE KG,1351214111342,BELGIUM - OPEN,130.00,111122.jpg
111348,PREMIUM BELGIUM OPEN WHITE MUSHROOM NOUGAT & MIXED NUTS &  HAZELNUTS & GIANDUJA KG,1351214111348,BELGIUM - OPEN,130.00,111100.png
111349,PREMIUM BELGIUM OPEN WHITE PARIS PLAIN KG,1351214111349,BELGIUM - OPEN,130.00,111135.png
111350,PREMIUM BELGIUM OPEN WHITE PISTACHIO LEAF PISTACHIO & CRISPY & CARAMEL KG,1351214111350,BELGIUM - OPEN,130.00,111126.png
111351,PREMIUM BELGIUM OPEN WHITE PISTACHIO LUXE PISTACHIO KG,1351214111351,BELGIUM - OPEN,130.00,111124.jpg
111352,PREMIUM BELGIUM OPEN WHITE PISTACHIO ROSE PISTACHIO ROSE KG,1351214111352,BELGIUM - OPEN,130.00,111352.jpg
111353,PREMIUM BELGIUM OPEN WHITE PLAIN SQUARE PLAIN SQUARE KG,1351214111353,BELGIUM - OPEN,130.00,111353.png
111354,PREMIUM BELGIUM OPEN WHITE ROYAL BAR FEUILLETINE BISCUIT & CHOCOLATE KG,1351214111354,BELGIUM - OPEN,130.00,111101.jpg
111355,PREMIUM BELGIUM OPEN WHITE ROYAL CARAMEL BAR  CARAMEL & CHOCOLATE KG,1351214111355,BELGIUM - OPEN,130.00,111102.jpg
111356,PREMIUM BELGIUM OPEN WHITE ROYAL SEAL NOUGAT & ALMONDS KG,1351214111356,BELGIUM - OPEN,130.00,111087.jpg
111357,PREMIUM BELGIUM OPEN WHITE RUBY PRISM GIANDUJA & CARAMEL KG,1351214111357,BELGIUM - OPEN,130.00,111125.jpg
111358,PREMIUM BELGIUM OPEN BROWN BLISS SQUARE GIANDUJA & CARAMEL & HAZELNUTS KG,1351214111358,BELGIUM - OPEN,130.00,111358.jpg
111359,PREMIUM BELGIUM OPEN BROWN CHOCO ALMOND SQUARE ALMOND KG,1351214111359,BELGIUM - OPEN,130.00,111359.png
111360,PREMIUM BELGIUM OPEN BROWN CHOCO CRISPY SQUARE CRISPY KG,1351214111360,BELGIUM - OPEN,130.00,111140.jpg
111361,PREMIUM BELGIUM OPEN BROWN CHOCO DOME CHEESECAKE & STRAWBERRIES KG,1351214111361,BELGIUM - OPEN,130.00,111361.jpg
111362,PREMIUM BELGIUM OPEN BROWN CHOCO HAZELNUT SQUARE  HAZELNUT KG,1351214111362,BELGIUM - OPEN,130.00,111362.png
111363,PREMIUM BELGIUM OPEN BROWN PISTACHIO KUNAFA KG,1351214111363,BELGIUM - OPEN,180.00,110944.jpg
111364,PREMIUM BELGIUM OPEN BROWN CHOCO MATRESS GIANDUJA & NUTS & FEUILLETINE KG,1351214111364,BELGIUM - OPEN,130.00,111364.jpg
111365,PREMIUM BELGIUM OPEN BROWN CHOCO PISTACHIO SQUARE PISTACHIO KG,1351214111365,BELGIUM - OPEN,130.00,111138.jpg
111366,PREMIUM BELGIUM OPEN BROWN CHOCO PLAIN SQUARE PLAIN KG,1351214111366,BELGIUM - OPEN,130.00,111366.jpg
111367,PREMIUM BELGIUM OPEN BROWN CHOCO RING OREO BISCUIT FILLING KG,1351214111367,BELGIUM - OPEN,130.00,111367.jpg
111368,PREMIUM BELGIUM OPEN BROWN CHOCO RIPPLE CUP CARAMEL & CREAM KG,1351214111368,BELGIUM - OPEN,130.00,111093.png
111369,PREMIUM BELGIUM OPEN BROWN CHOCO SQUIRREL HAZELNUT NOUGAT & ALMONDS & CARAMEL KG,1351214111369,BELGIUM - OPEN,130.00,111097.jpg
111370,PREMIUM BELGIUM OPEN BROWN CHOCO SQUIRREL PLAIN & BELGIAN KG,1351214111370,BELGIUM - OPEN,130.00,111370.jpg
111371,PREMIUM BELGIUM OPEN BROWN CHOCO SWIRL TRUFFLE & PISTACHIO NUTS KG,1351214111371,BELGIUM - OPEN,130.00,111371.jpg
111372,PREMIUM BELGIUM OPEN BROWN CHOCO WAFER SQUARE WAFER KG,1351214111372,BELGIUM - OPEN,130.00,111137.jpg
111374,PREMIUM BELGIUM OPEN BROWN DALLAH COFFEE KG,1351214111374,BELGIUM - OPEN,130.00,111374.jpg
111375,PREMIUM BELGIUM OPEN BROWN DIRHAM NUTELLA & HAZELNUTS KG,1351214111375,BELGIUM - OPEN,130.00,111375.jpg
111376,PREMIUM BELGIUM OPEN BROWN GOLDEN LINE PEANUT & CARAMEL KG,1351214111376,BELGIUM - OPEN,130.00,111115.png
111377,PREMIUM BELGIUM OPEN BROWN HAZEL CROWN NUTELLA & HAZELNUTS KG,1351214111377,BELGIUM - OPEN,130.00,111377.jpg
111378,PREMIUM BELGIUM OPEN BROWN HAZELNUT PRALINE & TRUFFLE & WHOLE HAZELNUT KG,1351214111378,BELGIUM - OPEN,130.00,111378.jpg
111379,PREMIUM BELGIUM OPEN BROWN TEAR HAZELNUT KG,1351214111379,BELGIUM - OPEN,130.00,111127.png
111380,PREMIUM BELGIUM OPEN BROWN LULU CUP CUP OF KIBANDER & LULU PIECE KG,1351214111380,BELGIUM - OPEN,130.00,111380.jpg
111386,PREMIUM BELGIUM OPEN BROWN MUSHROOM NOUGAT & MIXED NUTS &  HAZELNUTS & GIANDUJA KG,1351214111386,BELGIUM - OPEN,130.00,111100.png
111387,PREMIUM BELGIUM OPEN BROWN PARIS PLAIN KG,1351214111387,BELGIUM - OPEN,130.00,111135.png
111388,PREMIUM BELGIUM OPEN BROWN PISTACHIO LEAF PISTACHIO & CRISPY & CARAMEL KG,1351214111388,BELGIUM - OPEN,130.00,111126.png
111389,PREMIUM BELGIUM OPEN YELLOW PISTACHIO LUXE PISTACHIO KG,1351214111389,BELGIUM - OPEN,130.00,111124.jpg
111390,PREMIUM BELGIUM OPEN BROWN PISTACHIO ROSE PISTACHIO ROSE KG,1351214111390,BELGIUM - OPEN,130.00,111128.jpg
111391,PREMIUM BELGIUM OPEN BROWN PLAIN SQUARE PLAIN SQUARE KG,1351214111391,BELGIUM - OPEN,130.00,111391.png
111392,PREMIUM BELGIUM OPEN BROWN ROYAL BAR FEUILLETINE BISCUIT & CHOCOLATE KG,1351214111392,BELGIUM - OPEN,130.00,111392.jpg
111393,PREMIUM BELGIUM OPEN BROWN ROYAL CARAMEL BAR  CARAMEL & CHOCOLATE KG,1351214111393,BELGIUM - OPEN,130.00,111393.jpg
111394,PREMIUM BELGIUM OPEN BROWN ROYAL SEAL NOUGAT & ALMONDS KG,1351214111394,BELGIUM - OPEN,130.00,111394.jpg
111395,PREMIUM BELGIUM OPEN BROWN RUBY PRISM GIANDUJA & CARAMEL KG,1351214111395,BELGIUM - OPEN,130.00,111125.jpg
111713,PREMIUM BELGIUM OPEN GREEN REGAL SQUARE PISTACHIO & MASTIC KG,1351214111713,BELGIUM - OPEN,130.00,111086.jpg
111714,PREMIUM BELGIUM OPEN GREEN ROYAL SEAL NOUGAT & ALMONDS KG,1351214111714,BELGIUM - OPEN,130.00,111087.jpg
111715,PREMIUM BELGIUM OPEN GREEN BLISS SQUARE GIANDUJA & CARAMEL & HAZELNUTS KG,1351214111715,BELGIUM - OPEN,130.00,111088.jpg
111716,"PREMIUM BELGIUM OPEN GREEN PARIS HAZELNUT PRALINE & HONEY, CARAMEL & HAZELNUTS & COFFEE KG",1351214111716,BELGIUM - OPEN,130.00,111089.jpg
111717,PREMIUM BELGIUM OPEN GREEN CHOCO MAP SAFFRON & PISTACHIO KG,1351214111717,BELGIUM - OPEN,130.00,111090.png
111718,PREMIUM BELGIUM OPEN GREEN TRIO HARMONY A HAZELNUT & CARAMEL KG,1351214111718,BELGIUM - OPEN,130.00,111091.png
111719,PREMIUM BELGIUM OPEN GREEN CHOCO TEAR GIANDUJA & CARAMEL & FEUILLETINE  & NUTS & HAZELNUTS KG,1351214111719,BELGIUM - OPEN,130.00,111092.jpg
111720,PREMIUM BELGIUM OPEN GREEN CHOCO RIPPLE CUP CARAMEL & CREAM KG,1351214111720,BELGIUM - OPEN,130.00,111093.png
111721,PREMIUM BELGIUM OPEN GREEN CHOCO SQUIRREL CHEESECAKE & STRAWBERRIES  & BISCUIT KG,1351214111721,BELGIUM - OPEN,130.00,111094.png
111722,PREMIUM BELGIUM OPEN GREEN DIRHAM NUTELLA & HAZELNUTS KG,1351214111722,BELGIUM - OPEN,130.00,111095.jpg
111723,PREMIUM BELGIUM OPEN GREEN CHOCO MATRESS GIANDUJA & NUTS & FEUILLETINE KG,1351214111723,BELGIUM - OPEN,130.00,111096.jpg
111724,PREMIUM BELGIUM OPEN GREEN CHOCO SQUIRREL HAZELNUT NOUGAT & ALMONDS & CARAMEL KG,1351214111724,BELGIUM - OPEN,130.00,111097.jpg
111725,PREMIUM BELGIUM OPEN GREEN GOLDEN LINE HAZELNUT GIANDUJA & CARAMEL KG,1351214111725,BELGIUM - OPEN,130.00,111098.png
111726,PREMIUM BELGIUM OPEN GREEN CHOCO BALL HAZELNUT PASTE KG,1351214111726,BELGIUM - OPEN,130.00,111099.jpg
111727,PREMIUM BELGIUM OPEN GREEN MUSHROOM NOUGAT & MIXED NUTS &  HAZELNUTS & GIANDUJA KG,1351214111727,BELGIUM - OPEN,130.00,111100.png
111728,PREMIUM BELGIUM OPEN GREEN ROYAL BAR FEUILLETINE BISCUIT & CHOCOLATE KG,1351214111728,BELGIUM - OPEN,130.00,111101.jpg
111729,PREMIUM BELGIUM OPEN GREEN ROYAL CARAMEL BAR  CARAMEL & CHOCOLATE KG,1351214111729,BELGIUM - OPEN,130.00,111102.jpg
111730,PREMIUM BELGIUM OPEN GREEN HAZEL CROWN NUTELLA & HAZELNUTS KG,1351214111730,BELGIUM - OPEN,130.00,111103.jpg
111731,PREMIUM BELGIUM OPEN GREEN DALLAH COFFEE KG,1351214111731,BELGIUM - OPEN,130.00,111104.jpg
111737,PREMIUM BELGIUM OPEN GREEN CHOCO DOME CHEESECAKE & STRAWBERRIES KG,1351214111737,BELGIUM - OPEN,130.00,111110.jpg
111738,PREMIUM BELGIUM OPEN GREEN HAZELNUT PES HAZELNUT PRALINE & TRUFFLE & WHOLE HAZELNUT KG,1351214111738,BELGIUM - OPEN,130.00,111111.png
111739,PREMIUM BELGIUM OPEN GREEN ANDALUSIA GIANDUJA & CARAMEL & CRISPY KG,1351214111739,BELGIUM - OPEN,130.00,111112.png
111741,PREMIUM BELGIUM OPEN GREEN CHOCO BRICK PRALINE SESAME & CARAMEL KG,1351214111741,BELGIUM - OPEN,130.00,111114.png
111742,PREMIUM BELGIUM OPEN GREEN GOLDEN LINE PEANUT & CARAMEL KG,1351214111742,BELGIUM - OPEN,130.00,111115.png
111743,PREMIUM BELGIUM OPEN GREEN CHOCO RING OREO BISCUIT FILLING KG,1351214111743,BELGIUM - OPEN,130.00,111116.jpg
111744,PREMIUM BELGIUM OPEN GREEN CHOCO SQUIRREL COFFEE FILLING & CREAM KG,1351214111744,BELGIUM - OPEN,130.00,111117.png
111745,PREMIUM BELGIUM OPEN GREEN HEART HAZELNUT GIANDUJA & ALMOND NUTS KG,1351214111745,BELGIUM - OPEN,130.00,111118.jpg
111746,PREMIUM BELGIUM OPEN GREEN CHOCO SWIRL TRUFFLE & PISTACHIO NUTS KG,1351214111746,BELGIUM - OPEN,130.00,111119.jpg
111747,PREMIUM BELGIUM OPEN GREEN SNOW HOUSE CHOCOLATE & NUTS & PISTACHIO KG,1351214111747,BELGIUM - OPEN,130.00,111120.jpg
111748,PREMIUM BELGIUM OPEN GREEN LULU CUP CUP OF KIBANDER & LULU PIECE KG,1351214111748,BELGIUM - OPEN,130.00,111122.jpg
111750,PREMIUM BELGIUM OPEN BLUE PISTACHIO LUXE PISTACHIO KG,1351214111750,BELGIUM - OPEN,130.00,111124.jpg
111751,PREMIUM BELGIUM OPEN GREEN RUBY PRISM GIANDUJA & CARAMEL KG,1351214111751,BELGIUM - OPEN,130.00,111125.jpg
111752,PREMIUM BELGIUM OPEN GREEN PISTACHIO LEAF PISTACHIO & CRISPY & CARAMEL KG,1351214111752,BELGIUM - OPEN,130.00,111126.png
111754,PREMIUM BELGIUM OPEN GREEN PISTACHIO ROSE PISTACHIO ROSE KG,1351214111754,BELGIUM - OPEN,130.00,111128.jpg
111755,PREMIUM BELGIUM OPEN GREEN PLAIN SQUARE PLAIN SQUARE KG,1351214111755,BELGIUM - OPEN,130.00,111755.png
111756,PREMIUM BELGIUM OPEN GREEN CHOCO SQUIRREL PLAIN & BELGIAN KG,1351214111756,BELGIUM - OPEN,130.00,111130.jpg
111761,PREMIUM BELGIUM OPEN GREEN PARIS PLAIN KG,1351214111761,BELGIUM - OPEN,130.00,111135.png
111762,PREMIUM BELGIUM OPEN GREEN CHOCO PLAIN SQUARE PLAIN KG,1351214111762,BELGIUM - OPEN,130.00,111136.jpg
111763,PREMIUM BELGIUM OPEN GREEN CHOCO WAFER SQUARE WAFER KG,1351214111763,BELGIUM - OPEN,130.00,111137.jpg
111764,PREMIUM BELGIUM OPEN GREEN CHOCO PISTACHIO SQUARE PISTACHIO KG,1351214111764,BELGIUM - OPEN,130.00,111138.jpg
111765,PREMIUM BELGIUM OPEN GREEN CHOCO HAZELNUT SQUARE  HAZELNUT KG,1351214111765,BELGIUM - OPEN,130.00,111765.png
111766,PREMIUM BELGIUM OPEN GREEN CHOCO CRISPY SQUARE CRISPY KG,1351214111766,BELGIUM - OPEN,130.00,111140.jpg
111767,PREMIUM BELGIUM OPEN GREEN PISTACHIO KUNAFA KG,1351214111767,BELGIUM - OPEN,180.00,110944.jpg
111768,PREMIUM BELGIUM OPEN GREEN CHOCO ALMOND SQUARE ALMOND KG,1351214111768,BELGIUM - OPEN,130.00,111768.png
111769,PREMIUM BELGIUM OPEN GREEN HEART PRALINE HAZELNUT CARAMEL KG,1351214111769,BELGIUM - OPEN,130.00,111281.jpg
111770,PREMIUM BELGIUM OPEN GREEN HAZELNUT CARAMEL KG,1351214111770,BELGIUM - OPEN,130.00,111311.jpg
111771,PREMIUM BELGIUM OPEN GREEN SQUARE WITH LOTUS KG,1351214111771,BELGIUM - OPEN,130.00,111771.png
111772,PREMIUM BELGIUM OPEN GREEN CORNFLAKES KG,1351214111772,BELGIUM - OPEN,130.00,111473.jpg
111774,PREMIUM BELGIUM OPEN RED REGAL SQUARE PISTACHIO & MASTIC KG,1351214111774,BELGIUM - OPEN,130.00,111086.jpg
111775,PREMIUM BELGIUM OPEN RED ROYAL SEAL NOUGAT & ALMONDS KG,1351214111775,BELGIUM - OPEN,130.00,111087.jpg
111776,PREMIUM BELGIUM OPEN RED BLISS SQUARE GIANDUJA & CARAMEL & HAZELNUTS KG,1351214111776,BELGIUM - OPEN,130.00,111088.jpg
111777,"PREMIUM BELGIUM OPEN RED PARIS HAZELNUT PRALINE & HONEY, CARAMEL & HAZELNUTS & COFFEE KG",1351214111777,BELGIUM - OPEN,130.00,111089.jpg
111778,PREMIUM BELGIUM OPEN RED CHOCO MAP SAFFRON & PISTACHIO KG,1351214111778,BELGIUM - OPEN,130.00,111090.png
111779,PREMIUM BELGIUM OPEN RED TRIO HARMONY A HAZELNUT & CARAMEL KG,1351214111779,BELGIUM - OPEN,130.00,111091.png
111780,PREMIUM BELGIUM OPEN RED CHOCO TEAR GIANDUJA & CARAMEL & FEUILLETINE  & NUTS & HAZELNUTS KG,1351214111780,BELGIUM - OPEN,130.00,111092.jpg
111781,PREMIUM BELGIUM OPEN RED CHOCO RIPPLE CUP CARAMEL & CREAM KG,1351214111781,BELGIUM - OPEN,130.00,111093.png
111782,PREMIUM BELGIUM OPEN RED CHOCO SQUIRREL CHEESECAKE & STRAWBERRIES  & BISCUIT KG,1351214111782,BELGIUM - OPEN,130.00,111094.png
111783,PREMIUM BELGIUM OPEN RED DIRHAM NUTELLA & HAZELNUTS KG,1351214111783,BELGIUM - OPEN,130.00,111095.jpg
111784,PREMIUM BELGIUM OPEN RED CHOCO MATRESS GIANDUJA & NUTS & FEUILLETINE KG,1351214111784,BELGIUM - OPEN,130.00,111096.jpg
111785,PREMIUM BELGIUM OPEN RED CHOCO SQUIRREL HAZELNUT NOUGAT & ALMONDS & CARAMEL KG,1351214111785,BELGIUM - OPEN,130.00,111097.jpg
111786,PREMIUM BELGIUM OPEN RED GOLDEN LINE HAZELNUT GIANDUJA & CARAMEL KG,1351214111786,BELGIUM - OPEN,130.00,111098.png
111787,PREMIUM BELGIUM OPEN RED CHOCO BALL HAZELNUT PASTE KG,1351214111787,BELGIUM - OPEN,130.00,111099.jpg
111788,PREMIUM BELGIUM OPEN RED MUSHROOM NOUGAT & MIXED NUTS &  HAZELNUTS & GIANDUJA KG,1351214111788,BELGIUM - OPEN,130.00,111100.png
111789,PREMIUM BELGIUM OPEN RED ROYAL BAR FEUILLETINE BISCUIT & CHOCOLATE KG,1351214111789,BELGIUM - OPEN,130.00,111101.jpg
111790,PREMIUM BELGIUM OPEN RED ROYAL CARAMEL BAR  CARAMEL & CHOCOLATE KG,1351214111790,BELGIUM - OPEN,130.00,111102.jpg
111791,PREMIUM BELGIUM OPEN RED HAZEL CROWN NUTELLA & HAZELNUTS KG,1351214111791,BELGIUM - OPEN,130.00,111103.jpg
111792,PREMIUM BELGIUM OPEN RED DALLAH COFFEE KG,1351214111792,BELGIUM - OPEN,130.00,111104.jpg
111798,PREMIUM BELGIUM OPEN RED CHOCO DOME CHEESECAKE & STRAWBERRIES KG,1351214111798,BELGIUM - OPEN,130.00,111110.jpg
111799,PREMIUM BELGIUM OPEN RED HAZELNUT PES HAZELNUT PRALINE & TRUFFLE & WHOLE HAZELNUT KG,1351214111799,BELGIUM - OPEN,130.00,111111.png
111800,PREMIUM BELGIUM OPEN RED ANDALUSIA GIANDUJA & CARAMEL & CRISPY KG,1351214111800,BELGIUM - OPEN,130.00,111112.png
111802,PREMIUM BELGIUM OPEN RED CHOCO BRICK PRALINE SESAME & CARAMEL KG,1351214111802,BELGIUM - OPEN,130.00,111114.png
111803,PREMIUM BELGIUM OPEN RED GOLDEN LINE PEANUT & CARAMEL KG,1351214111803,BELGIUM - OPEN,130.00,111115.png
111804,PREMIUM BELGIUM OPEN RED CHOCO RING OREO BISCUIT FILLING KG,1351214111804,BELGIUM - OPEN,130.00,111116.jpg
111805,PREMIUM BELGIUM OPEN RED CHOCO SQUIRREL COFFEE FILLING & CREAM KG,1351214111805,BELGIUM - OPEN,130.00,111117.png
111806,PREMIUM BELGIUM OPEN RED HEART HAZELNUT GIANDUJA & ALMOND NUTS KG,1351214111806,BELGIUM - OPEN,130.00,111118.jpg
111807,PREMIUM BELGIUM OPEN RED CHOCO SWIRL TRUFFLE & PISTACHIO NUTS KG,1351214111807,BELGIUM - OPEN,130.00,111119.jpg
111808,PREMIUM BELGIUM OPEN RED SNOW HOUSE CHOCOLATE & NUTS & PISTACHIO KG,1351214111808,BELGIUM - OPEN,130.00,111120.jpg
111809,PREMIUM BELGIUM OPEN RED LULU CUP CUP OF KIBANDER & LULU PIECE KG,1351214111809,BELGIUM - OPEN,130.00,111122.jpg
111811,PREMIUM BELGIUM OPEN PURPLE PISTACHIO LUXE PISTACHIO KG,1351214111811,BELGIUM - OPEN,130.00,111124.jpg
111812,PREMIUM BELGIUM OPEN RED RUBY PRISM GIANDUJA & CARAMEL KG,1351214111812,BELGIUM - OPEN,130.00,111125.jpg
111813,PREMIUM BELGIUM OPEN RED PISTACHIO LEAF PISTACHIO & CRISPY & CARAMEL KG,1351214111813,BELGIUM - OPEN,130.00,111126.png
111815,PREMIUM BELGIUM OPEN RED PISTACHIO ROSE PISTACHIO ROSE KG,1351214111815,BELGIUM - OPEN,130.00,111128.jpg
111816,PREMIUM BELGIUM OPEN RED PLAIN SQUARE PLAIN SQUARE KG,1351214111816,BELGIUM - OPEN,130.00,111816.png
111817,PREMIUM BELGIUM OPEN RED CHOCO SQUIRREL PLAIN & BELGIAN KG,1351214111817,BELGIUM - OPEN,130.00,111130.jpg
111822,PREMIUM BELGIUM OPEN RED PARIS PLAIN KG,1351214111822,BELGIUM - OPEN,130.00,111135.png
111823,PREMIUM BELGIUM OPEN RED CHOCO PLAIN SQUARE PLAIN KG,1351214111823,BELGIUM - OPEN,130.00,111136.jpg
111824,PREMIUM BELGIUM OPEN RED CHOCO WAFER SQUARE WAFER KG,1351214111824,BELGIUM - OPEN,130.00,111137.jpg
111825,PREMIUM BELGIUM OPEN RED CHOCO PISTACHIO SQUARE PISTACHIO KG,1351214111825,BELGIUM - OPEN,130.00,111138.jpg
111826,PREMIUM BELGIUM OPEN RED CHOCO HAZELNUT SQUARE  HAZELNUT KG,1351214111826,BELGIUM - OPEN,130.00,111826.png
111827,PREMIUM BELGIUM OPEN RED CHOCO CRISPY SQUARE CRISPY KG,1351214111827,BELGIUM - OPEN,130.00,111140.jpg
111828,PREMIUM BELGIUM OPEN RED PISTACHIO KUNAFA KG,1351214111828,BELGIUM - OPEN,180.00,110944.jpg
111829,PREMIUM BELGIUM OPEN RED CHOCO ALMOND SQUARE ALMOND KG,1351214111829,BELGIUM - OPEN,130.00,111829.png
111830,PREMIUM BELGIUM OPEN PURPLE HEART PRALINE HAZELNUT CARAMEL KG,1351214111830,BELGIUM - OPEN,130.00,111281.jpg
111831,PREMIUM BELGIUM OPEN RED HAZELNUT CARAMEL KG,1351214111831,BELGIUM - OPEN,130.00,111311.jpg
111832,PREMIUM BELGIUM OPEN RED SQUARE WITH LOTUS KG,1351214111832,BELGIUM - OPEN,130.00,111832.png
111833,PREMIUM BELGIUM OPEN RED CORNFLAKES KG,1351214111833,BELGIUM - OPEN,130.00,111473.jpg
111835,PREMIUM BELGIUM OPEN GOLD REGAL SQUARE PISTACHIO & MASTIC KG,1351214111835,BELGIUM - OPEN,130.00,111086.jpg
111836,PREMIUM BELGIUM OPEN GOLD ROYAL SEAL NOUGAT & ALMONDS KG,1351214111836,BELGIUM - OPEN,130.00,111087.jpg
111837,PREMIUM BELGIUM OPEN GOLD BLISS SQUARE GIANDUJA & CARAMEL & HAZELNUTS KG,1351214111837,BELGIUM - OPEN,130.00,111088.jpg
111838,"PREMIUM BELGIUM OPEN GOLD PARIS HAZELNUT PRALINE & HONEY, CARAMEL & HAZELNUTS & COFFEE KG",1351214111838,BELGIUM - OPEN,130.00,111089.jpg
111839,PREMIUM BELGIUM OPEN GOLD CHOCO MAP SAFFRON & PISTACHIO KG,1351214111839,BELGIUM - OPEN,130.00,111090.png
111840,PREMIUM BELGIUM OPEN GOLD TRIO HARMONY A HAZELNUT & CARAMEL KG,1351214111840,BELGIUM - OPEN,130.00,111091.png
111841,PREMIUM BELGIUM OPEN GOLD CHOCO TEAR GIANDUJA & CARAMEL & FEUILLETINE  & NUTS & HAZELNUTS KG,1351214111841,BELGIUM - OPEN,130.00,111092.jpg
111842,PREMIUM BELGIUM OPEN GOLD CHOCO RIPPLE CUP CARAMEL & CREAM KG,1351214111842,BELGIUM - OPEN,130.00,111093.png
111843,PREMIUM BELGIUM OPEN GOLD CHOCO SQUIRREL CHEESECAKE & STRAWBERRIES  & BISCUIT KG,1351214111843,BELGIUM - OPEN,130.00,111094.png
111844,PREMIUM BELGIUM OPEN GOLD DIRHAM NUTELLA & HAZELNUTS KG,1351214111844,BELGIUM - OPEN,130.00,111095.jpg
111845,PREMIUM BELGIUM OPEN GOLD CHOCO MATRESS GIANDUJA & NUTS & FEUILLETINE KG,1351214111845,BELGIUM - OPEN,130.00,111096.jpg
111846,PREMIUM BELGIUM OPEN GOLD CHOCO SQUIRREL HAZELNUT NOUGAT & ALMONDS & CARAMEL KG,1351214111846,BELGIUM - OPEN,130.00,111097.jpg
111847,PREMIUM BELGIUM OPEN GOLD GOLDEN LINE HAZELNUT GIANDUJA & CARAMEL KG,1351214111847,BELGIUM - OPEN,130.00,111847.png
111848,PREMIUM BELGIUM OPEN GOLD CHOCO BALL HAZELNUT PASTE KG,1351214111848,BELGIUM - OPEN,130.00,111099.jpg
111849,PREMIUM BELGIUM OPEN GOLD MUSHROOM NOUGAT & MIXED NUTS &  HAZELNUTS & GIANDUJA KG,1351214111849,BELGIUM - OPEN,130.00,111100.png
111850,PREMIUM BELGIUM OPEN GOLD ROYAL BAR FEUILLETINE BISCUIT & CHOCOLATE KG,1351214111850,BELGIUM - OPEN,130.00,111101.jpg
111851,PREMIUM BELGIUM OPEN GOLD ROYAL CARAMEL BAR  CARAMEL & CHOCOLATE KG,1351214111851,BELGIUM - OPEN,130.00,111102.jpg
111852,PREMIUM BELGIUM OPEN GOLD HAZEL CROWN NUTELLA & HAZELNUTS KG,1351214111852,BELGIUM - OPEN,130.00,111103.jpg
111853,PREMIUM BELGIUM OPEN GOLD DALLAH COFFEE KG,1351214111853,BELGIUM - OPEN,130.00,111853.jpg
111859,PREMIUM BELGIUM OPEN GOLD CHOCO DOME CHEESECAKE & STRAWBERRIES KG,1351214111859,BELGIUM - OPEN,130.00,111110.jpg
111860,PREMIUM BELGIUM OPEN GOLD HAZELNUT PES HAZELNUT PRALINE & TRUFFLE & WHOLE HAZELNUT KG,1351214111860,BELGIUM - OPEN,130.00,111111.png
111861,PREMIUM BELGIUM OPEN GOLD ANDALUSIA GIANDUJA & CARAMEL & CRISPY KG,1351214111861,BELGIUM - OPEN,130.00,111112.png
111863,PREMIUM BELGIUM OPEN GOLD CHOCO BRICK PRALINE SESAME & CARAMEL KG,1351214111863,BELGIUM - OPEN,130.00,111114.png
111864,PREMIUM BELGIUM OPEN GOLD GOLDEN LINE PEANUT & CARAMEL KG,1351214111864,BELGIUM - OPEN,130.00,111864.jpg
111865,PREMIUM BELGIUM OPEN GOLD CHOCO RING OREO BISCUIT FILLING KG,1351214111865,BELGIUM - OPEN,130.00,111116.jpg
111866,PREMIUM BELGIUM OPEN GOLD CHOCO SQUIRREL COFFEE FILLING & CREAM KG,1351214111866,BELGIUM - OPEN,130.00,111117.png
111867,PREMIUM BELGIUM OPEN GOLD HEART HAZELNUT GIANDUJA & ALMOND NUTS KG,1351214111867,BELGIUM - OPEN,130.00,111118.jpg
111868,PREMIUM BELGIUM OPEN GOLD CHOCO SWIRL TRUFFLE & PISTACHIO NUTS KG,1351214111868,BELGIUM - OPEN,130.00,111119.jpg
